comment_id,av,id,like,时间戳,time,comments
119442928624 ,555548194,131534083,0,1656983955,2022-07-05 09:19:15,我们的right and power
119442179056 ,555548194,381471020,0,1656983385,2022-07-05 09:09:45,爱穿啥穿啥，光着也和我没啥关系
119441757664 ,555548194,4539682,0,1656983172,2022-07-05 09:06:12,乐
119441593568 ,555548194,527700482,86,1656983020,2022-07-05 09:03:40,祝大家都能拥有不用自证的人生
119441514304 ,555548194,17839774,1,1656982989,2022-07-05 09:03:09,也没人说寺庙不能穿紧身衣吧[辣眼睛]
119441415856 ,555548194,15296171,87,1656982905,2022-07-05 09:01:45,真的烦，金星老师有个采访说，哪来那么多标签。就事论事那么难？？？说句体育康健注意事项那么难？可能单用性别这种粗暴的方式攻击别人比较容易吧，也更容易吸引眼球，宣泄情绪。现在真是从网上包容性变差，渗透到了现实生活。
119441403152 ,555548194,49920787,1,1656982877,2022-07-05 09:01:17,"此条评论专做用于提高热度，希望更多人看到。
愿中国青年都摆脱冷气，只是向上走，不必听自暴自弃者的说话。能做事的做事，能发声的发声。有一分热，发一分光，就令萤火一般；也可以在黑暗里发一点光，不必等候炬火。
----鲁迅"
119441166304 ,555548194,15145725,4066,1656982705,2022-07-05 08:58:25,占用场地就当事双方好好沟通。不能好好沟通就用“媛”来污名化女性，从女性的行为动机上加以怀疑，这样的逻辑是没问题的吗？占用场地是不对的，看不顺眼就拿“媛”来骂人也是不对的。
119440649664 ,555548194,73493321,8,1656982256,2022-07-05 08:50:56,哈哈哈哈笑死了，你的理由好站不住脚啊
119440164448 ,555548194,131965950,10,1656981865,2022-07-05 08:44:25,亲妈打窝，越钓越多
119439001536 ,555548194,350017900,1,1656980968,2022-07-05 08:29:28,额，在不影响他人的情况下人家爱咋拍咋拍呗[]
119438559328 ,555548194,162542787,6344,1656980655,2022-07-05 08:24:15,昨天长得不怎么样一大爷大庭广众之下脱衣服穿个白背心还把腰（姑且称之为腰）漏出来，这个是不是路郎
119438498528 ,555548194,9463584,19,1656980497,2022-07-05 08:21:37,真厉害的nt说辞，运动场不就是用来运动的吗？运动场是用来拍照的？跳广场舞的？讲一个经历过的事，我大学和宿舍几个朋友约着去烫头，给烫头的老师都占满了，这时候来了几个女的也来烫头，一听说我们给烫头的老师都占了，张口就:一帮大老爷们烫什么头？给谁看啊？真就够离谱的
119438199056 ,555548194,481598002,3,1656980223,2022-07-05 08:17:03,“又不是所有女生都是这样的”[doge][doge][doge]
119437732160 ,555548194,2964428,637,1656979831,2022-07-05 08:10:31,谁想挑起男女对立啊，可是媛这个字不就是针对女性吗？各行各业博眼球的男女都有，为什么只造这个媛那个媛的词骂女性咧？倒是一视同仁啊？
119437557936 ,555548194,13017627,1586,1656979693,2022-07-05 08:08:13,最恐怖的事，我发现我看到他们配的的照片真的会相信他们说的媛，没有去了解，其实身材好展示一下又有什么呢，又没有赚我的钱[辣眼睛]我反省…三连了
119436972496 ,555548194,379487834,4,1656979018,2022-07-05 07:56:58,体育运动，我没见过有人这么穿的
119436539984 ,555548194,13152303,14,1656978662,2022-07-05 07:51:02,我差不多是第一次接触像这类拳馆教练一样的营销号的视频，不得不说蛊惑性太强了！是有一套“自洽”的逻辑在里面的。没有点真正的独立思考能力的人被这种东西蛊惑洗脑可以说是太正常了，也算是明白为啥有那么多人在评论区里摇旗呐喊
119436453616 ,555548194,102367172,88,1656978582,2022-07-05 07:49:42,"行了别看评论了，有些东西是救不回来了[翻白眼]你说服不了他 他说服不了你，你说一万句他就不听不听，别人想传达的东西他就不懂不懂
算了吧算了吧，放过自己[保佑]"
119436373728 ,555548194,8109709,18,1656978510,2022-07-05 07:48:30,对，继续捧杀，什么场合穿什么衣服？不存在的，只要小仙女愿意，游泳的时候穿棉袄，跳伞的时候穿汉服都是可以的，反正亏的又不是一边看热闹的人，为何要阻止呢？
119436255696 ,555548194,12273282,2,1656978247,2022-07-05 07:44:07,提问：玩飞盘真的能锻炼吗？
119435948336 ,555548194,420291020,14,1656977953,2022-07-05 07:39:13,老实说，大部分路人其实是无感的，经过最近一轮的信息轰炸之后，飞盘媛这个词已经被刻进脑里了[辣眼睛]
119435863616 ,555548194,35818434,0,1656977848,2022-07-05 07:37:28,求视频里的电影[奥比岛_击爪]
119435686960 ,555548194,22118174,1786,1656977591,2022-07-05 07:33:11,真正别有用心的不是这些“某某媛”，而是那些给人随便贴这种标签的人。合着在他们眼里，女孩子做啥都是为了勾引男人呗？？？真是给他们脸了！[生气][生气][生气]
119435435872 ,555548194,1592403030,32,1656977447,2022-07-05 07:30:47,请循其本，不是穿衣服的问题，而是占用了足球场却一直把拍照作为主体，却没有发挥足球场的真正功能
119435467712 ,555548194,56824395,0,1656977363,2022-07-05 07:29:23,图穷匕见啊，搞来搞去是在搞性别对立
119435341968 ,555548194,179501237,1,1656977256,2022-07-05 07:27:36,回答你开头的问题，我是一个男人。
119434832576 ,555548194,17851214,32,1656976469,2022-07-05 07:14:29,不是飞盘运动的原因，而是以飞盘为前提去拍照，而不是去认真打盘的人。男女都一个样，不把飞盘当运动而是当社交。
119434725216 ,555548194,438612662,16,1656976286,2022-07-05 07:11:26,就是歧视在足球场玩飞盘的[微笑]
119434608304 ,555548194,25636335,411,1656976181,2022-07-05 07:09:41,某些东西从去年开始就一直致力于污名化“媛”这个字，好像中国那么多女字旁的贬义字都不够他们骂了非得自己把本来就是好的字眼恶化[给心心][给心心][给心心]
119434439264 ,555548194,1991424,1,1656975918,2022-07-05 07:05:18,收钱了吧
119434198880 ,555548194,396661016,47,1656975514,2022-07-05 06:58:34,"去什么场合就穿什么衣服，这不是理所当然的吗？别人在球场上穿着宽松的运动服，那些人非的穿瑜伽裤那种凸显身体特征的衣服，别人想不关注都难，那些人怎么不在领导开会时穿瑜伽裤？穿衣服要分场合的啊，这难道不是“礼”吗？
别人那样想还不行，非得按照那些人认为的不能那样想，这也太双标了。既然那些人那么穿了，就应该接受别人不同的想法啊，要么就别那么穿，要么就直接上法院去起诉，让法律扭转别人的想法。"
119433715088 ,555548194,243852376,11,1656974604,2022-07-05 06:43:24,社会发展这么快吗？我只知道飞盘是用来遛狗的
119433697040 ,555548194,507445763,0,1656974488,2022-07-05 06:41:28,咱就是说是不是应该穿一双底薄一点的鞋子，不然岂不是很容易崴脚嘛[笑哭]
119433020544 ,555548194,77640099,26,1656973118,2022-07-05 06:18:38,有啥广义不合理行为该骂骂该说说，又拿惯用套路新造个词可真没意思。骂的时候某些人麻烦摆正你的位置，就事论事也不是学不会吧，那就不要啥都往性的方面扯，一天天脑子里也不知道装的啥
119432930288 ,555548194,18411703,27,1656972811,2022-07-05 06:13:31,笑死 我就是质疑了一个化妆还去打球的男性 他是去打球还是拍照的 他就把我评论删了 心眼小小脾气吊吊[给心心][给心心] 我都没说他是球男爰 而且评论很多女生理中客让我不要对男性那么大恶意[保卫萝卜_问号][保卫萝卜_问号][保卫萝卜_问号]
119432760896 ,555548194,1040421925,0,1656972321,2022-07-05 06:05:21,[辣眼睛]这都是啥词汇，听都没听说过。
119431934848 ,555548194,386174433,15,1656969067,2022-07-05 05:11:07,@不可以涩瑟色 懂得尊重女性的男人，已经比其他男的进化超前了
119430847008 ,555548194,5616388,1,1656965090,2022-07-05 04:04:50,额，评论区来现身说法的人是真傻？我感觉不像是演的
119430704144 ,555548194,382325338,74,1656965045,2022-07-05 04:04:05,就算是去拍照的又怎么样呢？不都是自己喜欢的事情吗？又没有做什么非法的事情
119430295552 ,555548194,260244268,0,1656963754,2022-07-05 03:42:34,今天看见有组高端飞盘社交的局儿的，有入局标准的截图，不知道是真的假的
119429996800 ,555548194,17149638,63,1656963104,2022-07-05 03:31:44,审视的，不都是男性，厌女的女性也不是少数
119429807984 ,555548194,4584150,5173,1656962375,2022-07-05 03:19:35,其实我一直想问，为什么玩飞盘不能穿瑜伽裤？为什么玩飞盘结束后或开始前不能拍照？仅仅因为穿瑜伽裤和拍照就不配玩飞盘了吗？[热词系列_知识增加]
119429408720 ,555548194,15867431,103,1656961708,2022-07-05 03:08:28,"up揣着明白装糊涂
我们知道up揣着明白装糊涂
up知道我们知道up揣着明白装糊涂
我们知道up知道我们知道up揣着明白装糊涂
但没有人点破 只是因为所谓“自由”"
119429348416 ,555548194,36171607,62,1656961415,2022-07-05 03:03:35,只能说玩飞盘的里面掺杂了一些不管男的女的其实就是那种大家都懂的人  就像健身的一样除去真热爱健身的  也混入一些找刺激的男男女女[辣眼睛][辣眼睛]
119428953120 ,555548194,312616310,15,1656960841,2022-07-05 02:54:01,貌似有些道理，但是基本都是避重就轻。揣着明白装糊涂，挺没意思的。
119428248128 ,555548194,19365447,274,1656959332,2022-07-05 02:28:52,"自己花钱买的飞盘，自己租的场地[微笑]
大陆几千公里的土地找不到地方玩吗？非要去管别人，真以为自己继承的是皇位嗷"
119427981312 ,555548194,19365447,155,1656959147,2022-07-05 02:25:47,"[微笑]淦，我最近也在玩飞盘。
老子就是故意穿衣打扮又怎么了？？？
笑死嗷，就打扮，就打扮，气死你们，略略略！"
119427559728 ,555548194,1589262364,14,1656958422,2022-07-05 02:13:42,这项活动难道不是我跟我的狗玩的吗？[微笑]
119426215616 ,555548194,32172314,3,1656956953,2022-07-05 01:49:13,乐
119426177616 ,555548194,21826411,0,1656956831,2022-07-05 01:47:11,说得真好
119425790304 ,555548194,8585228,0,1656956418,2022-07-05 01:40:18,不关我的事，不关别人的事。
119425705824 ,555548194,13491141,0,1656956356,2022-07-05 01:39:16,渴望而得不到的怒火中烧
119425046912 ,555548194,37959436,0,1656955667,2022-07-05 01:27:47,这文案感觉不如djgun
119424364880 ,555548194,6568497,49,1656955144,2022-07-05 01:19:04,谁说污名化女性的就一定是男性[藏狐]
119424433184 ,555548194,158646620,0,1656955133,2022-07-05 01:18:53,支持up主
119423944480 ,555548194,43286438,11,1656954731,2022-07-05 01:12:11,你如果没接触过 那我给你提一嘴 飞盘媛这东西真的就是有啊 [怪我咯]
119423729360 ,555548194,3847756,26,1656954603,2022-07-05 01:10:03,哈哈哈哈乐，租两小时的场运动半小时，聊天半小时，拍照一小时。未来可期，希望中国飞盘能冲出亚洲看看能不能欧美的强度掰掰手腕
119423643008 ,555548194,671100,44,1656954577,2022-07-05 01:09:37,媚男是女性在男性话语主导环境下为了换取一定利益所不得不采取的一种方式，从某讲角度讲女性是一种受缚者状态，所以媚男是女性所要自我克服的一道坎，而不是用来批判女性的理由，批评女性媚男的人其实是在说，“凭什么我不能靠媚男获得什么你就可以？”真莫名其妙。
119423515184 ,555548194,8938721,370,1656954478,2022-07-05 01:07:58,笑死我了，某些人说什么足球场，这么能踢球也没见你们踢出亚洲，都是运动场，你们踢球一定要踢满场，又不是专业比赛，大家各玩各的，没见着谁碍着谁
119423164672 ,555548194,21688081,36,1656954220,2022-07-05 01:03:40,见识少的我好奇问一句，女生去运动的时候会浓妆艳抹吗？不怕妆花了吗
119423234688 ,555548194,471443212,146,1656954205,2022-07-05 01:03:25,目的不纯的人不是没有，但那一定只是少数，是坏人，不是女人坏。up的观点非常有参考价值，可惜带着情绪的男性观众们是一点也看不下去，反而又开始用惯用套路将营销号这顶帽子扣了上来
119422898464 ,555548194,53426282,1601,1656953987,2022-07-05 00:59:47,证明自己不是飞盘媛的时候，也相当于在和男的一起谴责飞盘媛，仿佛在说“我和那些博眼球的女性不是一类人，你们骂错人了”
119422126896 ,555548194,23600403,0,1656953470,2022-07-05 00:51:10,男人果然深谙分而治之的道理
119422051264 ,555548194,395992674,58,1656953394,2022-07-05 00:49:54,爱谁谁，足球飞脸上别找事就行，足球场上有足球很正常吧
119421941600 ,555548194,53193273,30,1656953330,2022-07-05 00:48:50,他们害怕女性，害怕女性特质，害怕父权的动摇，害怕女人和他们规定的不一样
119421423728 ,555548194,2045227838,18,1656953027,2022-07-05 00:43:47,长舌公们怎么什么都要管啊[撇嘴]
119421363664 ,555548194,1010405345,1,1656952913,2022-07-05 00:41:53,恍然大悟，你说的好有道理。
119421179648 ,555548194,735739,15,1656952866,2022-07-05 00:41:06,评论区跳脚的人可真多[doge]
119421138288 ,555548194,6211261,44,1656952789,2022-07-05 00:39:49,评论区现身说法
119420469408 ,555548194,389231868,175,1656952451,2022-07-05 00:34:11,"为什么女性好看又有实力就会被说造假 博流量 男性好看有实力就说德才兼备人生赢家 
如果哪天男性好看会被传谣言那才真的是“平等”[藏狐]"
119420587936 ,555548194,38129680,29,1656952442,2022-07-05 00:34:02,猎巫
119420573712 ,555548194,24370294,108,1656952417,2022-07-05 00:33:37,不为了秀身材，为什么要运动？好吃懒做才是生物本能呀。运动女孩，克服本能就是追求更美好的自己呀。[辣眼睛]
119420388800 ,555548194,16401649,4,1656952372,2022-07-05 00:32:52,一边当着小仙女，一边叫着男性凝视，好呵呵
119420234208 ,555548194,8791670,17,1656952319,2022-07-05 00:31:59,我不在乎他们穿啥，但是她们占了我球场，被我足球飞脸的时候，别过来跟我逼逼赖赖就行[辣眼睛]
119419921760 ,555548194,34971915,65,1656952052,2022-07-05 00:27:32,凭什么要发视频给某些人证明啊？太把自己当回事了吧
119419787824 ,555548194,275584302,149,1656952023,2022-07-05 00:27:03,咱就是说，我们女生努力健身干什么的呢，难道是被窝里摸着自己腹肌偷偷乐么
119419398128 ,555548194,11378291,11,1656951770,2022-07-05 00:22:50,飞盘猿的起因是，某些相亲活动邀请高质量男性参与，丢飞盘，就像雪糕刺客和国民雪糕，若是说雪糕是刺客是否在侮辱国名雪糕
119418201488 ,555548194,284788,0,1656951138,2022-07-05 00:12:18,这游戏现在能组出男女比例接近1：1的社交局（以前都是1：3），现在可是各种相亲联谊公司的热销产品。
119417626992 ,555548194,66650804,19,1656950860,2022-07-05 00:07:40,那种穿着暴露的，靠露出更多身体来展现自己所谓的美貌，就算嘴巴不说，就算是同性对其印象会好吗？至少在大学里穿着暴露的女生风评差都是从其他女生甚至是她们朋友那里传出来的，穿紧身衣为什么也会被说，不是因为飞盘，是健身房里那些做作的女性搞坏的，除去脑子不正常的，没人会觉得健身房乱象的参与者是品德高尚的好人吧？自证难，因为只能证明自己，一旦有更多的乱象出现，刚证明清白的自己就会被贴上新的负面标签，而且现在是女性整体风评变差，或许跟微博女权有关？又或许是新闻上女性的行为引起了大部分男性的不满（女性通过婚姻敛财在现今并不少见，以及经典的黑人女友）或者是女性之间的争端？还请大家明白，平民百姓是一个整体，两性的矛盾是媒体引导出来缓解某些尖锐问题的产物，比如结婚想要一个家很正常，但是房价凭什么那么高？希望大家能明白这个逻辑，我们真正的敌人是谁
119416986992 ,555548194,14525210,630,1656950511,2022-07-05 00:01:51,小仙女这个词也开始被某些人被污名化了
119415885296 ,555548194,38833305,15,1656950029,2022-07-04 23:53:49,还是呼吁呼吁小红薯的网红别这么作了
119414892128 ,555548194,2122227256,16,1656949542,2022-07-04 23:45:42,而且有时候会占公用足球场，好多次去踢球都差点吵架，这搁谁都会生气
119414883920 ,555548194,38833305,9,1656949531,2022-07-04 23:45:31,厚底鞋瑜伽裤去草地上碰瓷需要闪转腾挪的飞盘现在扯到拳，极限飞盘的要求您这装备十几分钟后需要看牙医。你不尊重这个运动，占据公共资源，别人怎么尊重你？经济基础决定上层建筑，反击方式首先是赚的比男的更多，那要求就是你先少想你的白马王子，你得自己变成宝马少女，可惜起码现在不太可能实现。
119414752272 ,555548194,191330722,51,1656949507,2022-07-04 23:45:07,给别人贴标签真的很可怕，还有因为一句话或一个行为动作对某一个定性，真的太可怕了，恐怖的是这些人还觉得自己很理智看穿了人性
119414315184 ,555548194,14696259,13,1656949345,2022-07-04 23:42:25,省流：他们喜欢穿 我喜欢看 有什么错
119414188144 ,555548194,12576370,79,1656949239,2022-07-04 23:40:39,这评论区真是大开眼界[辣眼睛]
119414131456 ,555548194,170781157,68,1656949207,2022-07-04 23:40:07,总有这样的声音，那么多质疑的网友，她出来证明一下不就好了，不证明就是默认！人家凭啥要回应狗叫？
119413423120 ,555548194,1155240862,9,1656948915,2022-07-04 23:35:15,虚空打靶
119412379936 ,555548194,36849935,2360,1656948485,2022-07-04 23:28:05,我还看到发什么师媛的呢？我可没见过批评长得好看穿得好看的男老师，却故意污名化女老师[辣眼睛][辣眼睛][辣眼睛]
119412403552 ,555548194,404239788,13,1656948423,2022-07-04 23:27:03,营销号 AI智能语音 蹭热度[吃瓜]
119411054112 ,555548194,59689230,26,1656947879,2022-07-04 23:17:59,文喜私关
119410854656 ,555548194,21994831,7,1656947830,2022-07-04 23:17:10,怎么反击
119410639952 ,555548194,432911493,1212,1656947765,2022-07-04 23:16:05,"最近唐＊打人事件，好多人说张挑男女对立，骂她就罢了，某些男网友一边骂还要一边谈论她的“奶”。
我真的，这种人有什么资格来谈什么女性，谈什么正义。"
119410754640 ,555548194,41656113,22,1656947759,2022-07-04 23:15:59,穿着潮鞋拍照真的是去运动的？
119410047888 ,555548194,15660833,18,1656947473,2022-07-04 23:11:13,不管是男性还是女性 根深蒂固的思想没那么容易改变 平权这种“损人不利己”的事情 是需要信仰的
119409816096 ,555548194,195032223,9482,1656947384,2022-07-04 23:09:44,我觉得可悲的事情是女性呼吁停止污名化的时候也要被说打拳，这个视频下就有现身说法，同时也能看到其他正在尝试污名化他人或其他群体的人群。
119409549888 ,555548194,12169255,20,1656947257,2022-07-04 23:07:37,不是，穿瑜伽裤什么的去玩对抗性强的运动？有些事懂得都懂，就别嘴硬了
119409468832 ,555548194,1705822248,39,1656947231,2022-07-04 23:07:11,营销号又出来带节奏
119408714976 ,555548194,3122145,988,1656946990,2022-07-04 23:03:10,"首先叫媛aoe肯定是不对的，因为少数去上升的人脑子都有问题[tv_黑人问号]至于衣服我觉得这个年头瑜伽裤和日常服饰没啥区别了，我们公司还有穿瑜伽裤上班的，早就习惯了这种装束出现在任何场景
但是有部分在构图方面，就像很多人去抓一些画师的构图说男凝啊、媚男啊什么的，那是否也需要批判这种拍照的构图呢[tv_思考]
另外就是说有没有一种可能无论男女，在运动场只拍照不运动，都会让人不舒服呢，足球场如果有男的不踢球在那一直摆poss拍照，可能下一秒球就到他头上了[tv_doge]"
119406622752 ,555548194,214511,5,1656946131,2022-07-04 22:48:51,自不自证啥的无所谓，我可以不用那些有污蔑意思的词汇，我可以不用我的对一些事物纯洁性的要求要求你，我也不想用我的标准审判你，但我有资格判断我和你不是一个世界的人，一旦做出这样的判断，那就可以打死不相往来，或者是彻底不需要顾及脸面的竞争。
119405129936 ,555548194,29026732,81,1656945508,2022-07-04 22:38:28,说真的去小红书看看吧，故意炒作故意黑红路线多了去了，有很多博主就是以此为荣，要想一个群体不被污名化，首先得看看是不是自己出了内鬼
119404283248 ,555548194,2954111,7,1656945219,2022-07-04 22:33:39,我为什么这么喜欢这个作者啊！好几篇内容都很有深度
119404244064 ,555548194,294570697,16,1656945171,2022-07-04 22:32:51,不能因为群体里的小部分正常人而正常看待一个群体
119402884688 ,555548194,34944024,60,1656944660,2022-07-04 22:24:20,？？？既然是外国传来的运动，那就去看看人家本来是怎么穿，有多激烈的，明明是正规运动，忽然变成网红打卡地
119402499856 ,555548194,272002037,8,1656944510,2022-07-04 22:21:50,虽然但是，小红书嘛，大家都知道的，各种炫富营销擦边[黑洞][黑洞]
119402243328 ,555548194,20574926,27,1656944396,2022-07-04 22:19:56,厚底鞋瑜伽裤去草地上碰瓷需要闪转腾挪的飞盘现在扯到拳，极限飞盘的要求您这装备十几分钟后需要看牙医。
119401371888 ,555548194,66433656,56,1656944050,2022-07-04 22:14:10,拒绝贴标签！拒绝污名化！拒绝性别对立！尊重个体，尊重自己
119400569904 ,555548194,381813909,13,1656943734,2022-07-04 22:08:54,取关了
119400403184 ,555548194,22200036,106,1656943644,2022-07-04 22:07:24,讲个笑话，穿衣自由
119399714720 ,555548194,23761874,4,1656943385,2022-07-04 22:03:05,我想知道在这种情况下该如何去反击
119399092112 ,555548194,17503974,88,1656943150,2022-07-04 21:59:10,自己不恪守底线想摘花，竟然把罪名怪在花自己太艳丽？？？
119398335792 ,555548194,408039930,3,1656942806,2022-07-04 21:53:26,？？？
119398123488 ,555548194,22119178,88,1656942744,2022-07-04 21:52:24,"如果大家想对“媛”这个污名化原因和过程以及更深刻的内涵分析 更深入了解的话，我很推荐大家去看沈奕斐老师的两期视频 希望大家能够看完后再发表评论 
up说得很对 自证就会陷入非常被动的状态 并且会更深刻大众对它的刻板印象 我们应该摒除自证心理 把自己看作是制定规则参与规则的第一性 我们完全没有必要依靠男性的标准去规定自己 生理差异也造成我们运动时服装个性训练强度训练姿势登差异 更别说“爱美”“拍照”与“运动”从来不是对立面 是对“媛”的污名化让他们认为一个美丽精致的女性发出照片时 她的行为具有商业意义的 我们要做的就是重新建立起“媛”的美好概念 由我们――women去定义 [保卫萝卜_哇]"
119397529136 ,555548194,25490640,1,1656942506,2022-07-04 21:48:26,讲得太好了
119396056352 ,555548194,19550993,5,1656941945,2022-07-04 21:39:05,有钱人道德标准高一点好像很难的嘛
119395594720 ,555548194,20945679,58,1656941769,2022-07-04 21:36:09,在我看来是一部分假的占据了太多的曝光败坏了大部分普通人的名声
119395442144 ,555548194,19550993,9,1656941643,2022-07-04 21:34:03,女权主义之下，女人不见得比男权主义的男人更加讨喜。你们横竖不会觉得西门庆是正面角色，为什么连对公众人物形象都不懂得维护的名人那么放宽呢？说到底还是拿了钱。
119393405120 ,555548194,335591760,4,1656940827,2022-07-04 21:20:27,你要别人为你叫好，就必须经得起打击
119392607280 ,555548194,350100517,1191,1656940511,2022-07-04 21:15:11,虽然up的名字太像营销号了，，但是文章和观点都很让人眼前一亮。毕竟没有营销号这么明白污名化环境下女性自证的困难。。。点个赞[支持][支持]
119392056272 ,555548194,53088107,7,1656940264,2022-07-04 21:11:04,不错的角度，豁然开朗
119391395408 ,555548194,13523467,2,1656939988,2022-07-04 21:06:28,无聊
119391209808 ,555548194,2060005736,2,1656939857,2022-07-04 21:04:17,建立秩序，就要建立规则。有些是明面的规则，有些是不明说的规则。规则视具体情况来设定完善程度，规则的建立同时就给打破规则的人带来了巨大的利益，从某种角度说就是给别人带来损失。
119390854624 ,555548194,260619243,39,1656939753,2022-07-04 21:02:33,啊？我为什么会关注到这个营销号。。。
119389971680 ,555548194,26636731,44,1656939394,2022-07-04 20:56:34,感觉男女被冤枉或被污名化都会不知所措，这是我们所有人都可能遇到的问题，无关男女，期望up出一期怎么应对这种情况的视频。
119389774048 ,555548194,617104732,12,1656939268,2022-07-04 20:54:28,讽刺写稿的记者可能就是女性
119389579568 ,555548194,7254036,158,1656939226,2022-07-04 20:53:46,真的好烦 每次都能迅速造出一大堆针对所有女性的词汇
