comment_id,av,id,like,时间戳,time,comments
132708418592 ,555434722,1389928692,0,1665066086,2022-10-06 22:21:26,牛逼
132474863664 ,555434722,474284047,1,1664908319,2022-10-05 02:31:59,足球篮球还分男组女组，这种运动男女混打是想啥，你们有些玩这个的男生说你们没安其他心，你说你自己信不
132467464560 ,555434722,142428987,1,1664901445,2022-10-05 00:37:25,我觉得，只要正常包场，就算包个场来做瑜伽又有什么问题呢。只要开心不就行了。球场包出去干别的的情况不是很正常？
132282817872 ,555434722,244274410,0,1664790081,2022-10-03 17:41:21,弄一只边牧来[doge]
132271318272 ,555434722,1977008,0,1664783912,2022-10-03 15:58:32,其实主要矛盾还是出在国内绿地太少了吧，像这样整片整片的运动场什么运动都可以开展，也不至于和足球抢场地
132257435504 ,555434722,28237537,0,1664776040,2022-10-03 13:47:20,这玩意技术跟身体强度有点要求啊，这玩意落地不会，那就是直接给你干医院去很正常
132151731840 ,555434722,439011785,0,1664705026,2022-10-02 18:03:46,不讨厌，尤其是晚上???
132013408624 ,555434722,18323168,0,1664614066,2022-10-01 16:47:46,什么时候开场人狗大战[doge]
131878643184 ,555434722,453132593,0,1664523996,2022-09-30 15:46:36,和人抢场地 和狗抢玩具 跑的没狗快 接的没狗准 身体没狗壮 玩的比狗花
131852663872 ,555434722,404626007,0,1664508169,2022-09-30 11:22:49,BGM是啥？
131706419744 ,555434722,688599051,0,1664378993,2022-09-28 23:29:53,看的我都想玩了
131648486128 ,555434722,226948945,0,1664343543,2022-09-28 13:39:03,感觉像橄榄球
131594726016 ,555434722,284040997,0,1664290282,2022-09-27 22:51:22,看了这个视频 我感觉不但足球玩不过 连飞盘可能也要被吊打
131578089472 ,555434722,1469910448,0,1664281936,2022-09-27 20:32:16,你是正常人，哈哈！
131577017088 ,555434722,1469910448,0,1664281485,2022-09-27 20:24:45,这玩意儿不爽，建议大家学习打手球，可爽了！
131350731056 ,555434722,621651423,0,1664105368,2022-09-25 19:29:28,作为十年的football忠实粉来看  这都不算什么！[呲牙]
131323543664 ,555434722,227542700,0,1664090145,2022-09-25 15:15:45,求bgm ，好人一生平安
131323080096 ,555434722,357934523,1,1664089880,2022-09-25 15:11:20,看着好痛
131288304560 ,555434722,5495462,0,1664070791,2022-09-25 09:53:11,聪明的足球场经营者，已经给球场画上了飞盘线了
131259745568 ,555434722,239636400,0,1664034756,2022-09-24 23:52:36,这样的飞盘我也喜欢玩
131210938304 ,555434722,92328272,0,1664011103,2022-09-24 17:18:23,人家是运动，飞盘元是揽客
131199336800 ,555434722,31871702,0,1664003989,2022-09-24 15:19:49,这不给假体颠出来?[吃瓜]
131184194880 ,555434722,1367458527,0,1663994963,2022-09-24 12:49:23,门将表示正常操作[脱单doge]
130986635872 ,555434722,177985294,1,1663842059,2022-09-22 18:20:59,丢手绢2D版[tv_冷漠][tv_冷漠]
130818551520 ,555434722,444769770,0,1663699717,2022-09-21 02:48:37,我怎么感觉玩法跟我们小学打沙包有点像啊[藏狐][藏狐][藏狐]
130732262208 ,555434722,10718516,0,1663646431,2022-09-20 12:00:31,不来下对比处刑吗？
130655473584 ,555434722,508435279,0,1663582536,2022-09-19 18:15:36,冒昧问一下，女生接飞盘铺地上前面不疼吗[脸红]
130536465584 ,555434722,1684483,0,1663493465,2022-09-18 17:31:05,有点橄榄球的味
130371238064 ,555434722,489979984,2,1663387400,2022-09-17 12:03:20,"素质呢.....视频里明明是正常的运动，为什么还要一堆人整个视频都在刷“都是狗玩的”
第一次见比较惊讶，发出不太合适的感叹可以理解，但是为什么还有说视频里的人是狗的？
素质在哪里？"
130079357600 ,555434722,703060769,0,1663162911,2022-09-14 21:41:51,你放错视频了吗……
130012290208 ,555434722,11649089,2,1663124885,2022-09-14 11:08:05,？所以飞盘到底是什么时候出现的运动？？真的是之前从来没有听说过
130008320144 ,555434722,434308158,2,1663122152,2022-09-14 10:22:32,别的不说，正经竞技运动都是男女分开的，国外这些飞盘都是分男子和女子。我最多只听说过奥林匹克男子组没有性别要求女子组必须是生理女性，以及马术这种低身体对抗的是混合，从来没听说过打竞技的极限飞盘还要男女混赛[疑惑]你平时玩玩男女一起倒没啥，怎么国内连联赛都男女混赛了[疑惑]
129923378096 ,555434722,345815410,0,1663056158,2022-09-13 16:02:38,如果是为了秀还是叫飞盘宝贝吧，就像足球宝贝那样。
129860403616 ,555434722,388997530,0,1662997585,2022-09-12 23:46:25,你跟他们说这才是飞盘，他们就要说了，这能一样吗？他们是职业的，我们只是玩玩。再说了，什么护具都没有，受伤了怎么办？
129668142496 ,555434722,518898564,0,1662887113,2022-09-11 17:05:13,属于是篮球，足球和沙袋的结合了
129505328960 ,555434722,341585840,1,1662789921,2022-09-10 14:05:21,真好，现在风向正常多了。认真搞体育！
129394544208 ,555434722,20898041,3,1662719712,2022-09-09 18:35:12,和我家博美一样玩的开心[嗑瓜子]
129380884160 ,555434722,27848533,0,1662713260,2022-09-09 16:47:40,国内飞盘就是为了拍照派展示面
129374600672 ,555434722,5987049,3,1662709582,2022-09-09 15:46:22,还有好多飞盘郎呢[星星眼]
129369432384 ,555434722,67275059,2,1662706358,2022-09-09 14:52:38,要是国内的足球场地真是像某些评论所说的每天爆满，大家都很积极去踢，那国足怎么还这么拉
129358395008 ,555434722,3839550,3,1662699823,2022-09-09 13:03:43,当年大学时候我们院足球赛被迫打断，原因是一个小网红要拍个抖音，庆祝八一。呵呵了都
129342969392 ,555434722,514603544,0,1662692014,2022-09-09 10:53:34,国内这小红书飞盘的运动量，真不如丢沙包的多[吃瓜]
129284044352 ,555434722,4459552,0,1662643536,2022-09-08 21:25:36,作橐厩蜿的，滑草？好耶！
129227486016 ,555434722,382199968,2,1662612433,2022-09-08 12:47:13,好玩吗
129201209264 ,555434722,44370870,0,1662595909,2022-09-08 08:11:49,这是个橄榄球的变种呀
129184556496 ,555434722,318889742,1,1662568182,2022-09-08 00:29:42,当初哄我们家狗子就是这么玩的[笑哭]
129171510464 ,555434722,34577917,0,1662561803,2022-09-07 22:43:23,这多热血，挥洒汗水，不听奔跑，跳跃翻滚！
129088159728 ,555434722,287919665,2,1662519223,2022-09-07 10:53:43,本质还是足球，只不过香蕉球妙传变得更简单了而已
129064589456 ,555434722,187867783,0,1662486195,2022-09-07 01:43:15,操场上最美的女孩！ 
129050167120 ,555434722,56897443,1,1662476986,2022-09-06 23:09:46,"笑死，穿个瑜伽裤勒紧就就觉得自己是健身达人了，这东西发展起来又毒害一大批人
当一个小圈子以负面内容火出圈之后，人们看待这个圈子都只会用第一次的负面印象来看[热][热]"
129001820608 ,555434722,77547008,0,1662452936,2022-09-06 16:28:56,弹幕全是对喷 好幼稚
128980617472 ,555434722,22211804,3,1662439032,2022-09-06 12:37:12,这个运动狗应该比人强吧？
128962614208 ,555434722,1515847953,3,1662427663,2022-09-06 09:27:43,[捂脸]前几年飞盘还没火起来的时候足球照样不行，现在倒好找了个飞盘的借口，以后不得找橄榄球的麻烦[捂脸]难怪中国足球搞不起来，自己在那找理由，内讧，真的无语
128956341456 ,555434722,255907892,0,1662421977,2022-09-06 07:52:57,这个要抗摔
128950972288 ,555434722,286112271,0,1662407891,2022-09-06 03:58:11,其实我很难理解为什么有说场地的，人家玩飞盘就玩呗，收费场地，人家也是给钱进场，你说你霸占公关地方这就说不过去。
128948689520 ,555434722,6829824,3,1662402370,2022-09-06 02:26:10,我记忆中的飞盘一个是打枪的，还有一个是扔出去，狗子飞跑过去接的= =！[doge]
128947514816 ,555434722,39096173,1,1662400789,2022-09-06 01:59:49,我没有别的意思。但要我去玩一个别人扔飞盘我去捡的游戏 我大概率是不愿意的[妙啊]
128935098128 ,555434722,3192912,0,1662391880,2022-09-05 23:31:20,外国人就是会玩，阳光下成长起来的民族
128910772768 ,555434722,652096,2,1662380692,2022-09-05 20:24:52,说占用场地的，免费场地的环境以及灯光根本满足不了飞盘社交活动的需求。花钱租的场地，躺草地上睡觉也是他们的自由。
128908733024 ,555434722,89428599,0,1662379686,2022-09-05 20:08:06,好好玩这个运动量不比足球少，
128907211536 ,555434722,232582704,4,1662378951,2022-09-05 19:55:51,国内飞盘笑死，还不如看贵州篮球杯
128782369536 ,555434722,1550177255,0,1662291717,2022-09-04 19:41:57,这不就是饼状的橄榄球?
128767585056 ,555434722,37649292,0,1662284620,2022-09-04 17:43:40,比狗飞得都高
128673550432 ,555434722,1887006346,0,1662217465,2022-09-03 23:04:25,卧槽，这样在草坪上摩一下……很疼吧
128593229632 ,555434722,417039372,1,1662179159,2022-09-03 12:25:59,这尼玛叫老少皆宜？
128556923664 ,555434722,13123766,3,1662142392,2022-09-03 02:13:12,飞盘运动，跑的没狗快，接的没狗准，叫的比狗欢，玩的比狗花
128496490944 ,555434722,444217435,0,1662112432,2022-09-02 17:53:52,鱼跃这几下子确实可以
128377263664 ,555434722,36627805,0,1662029935,2022-09-01 18:58:55,这可比国足有观赏性[脱单doge]
128344091856 ,555434722,248441063,3,1662010358,2022-09-01 13:32:38,讨厌的不是飞盘这个游戏，讨厌的是打着飞盘的旗号在哪行龌蹉的事
128330526640 ,555434722,34466903,3,1662003433,2022-09-01 11:37:13,讲个笑话飞盘橄榄球足球都可以用足球场地，只要付钱。
128258902224 ,555434722,455981,1,1661947108,2022-08-31 19:58:28,人是真玩啊
128238760064 ,555434722,321305889,2,1661938426,2022-08-31 17:33:46,人家把飞盘当运动，她们把飞盘当生意。
127928826544 ,555434722,404070146,1,1661762758,2022-08-29 16:45:58,看起来好危险啊
127763247600 ,555434722,352417881,1,1661665620,2022-08-28 13:47:00,玩飞盘不是应该穿露肩背心，瑜伽裤吗[doge][doge]
127566334672 ,555434722,357309547,0,1661536610,2022-08-27 01:56:50,我的评价是不如我们，人家玩飞盘没我们穿的凉快[doge]
127445102800 ,555434722,452229068,0,1661482720,2022-08-26 10:58:40,这种才配和我们足球抢场地[doge]
127346880560 ,555434722,27713205,1,1661420654,2022-08-25 17:44:14,国民身体素质不是靠玩飞盘出来的 是国民有了身体素质才去玩飞盘的 本末倒置 认清差距 立正挨打[口罩][口罩]
127328528032 ,555434722,663237783,0,1661412011,2022-08-25 15:20:11,玩得还不如边牧
127284896784 ,555434722,243825713,0,1661391740,2022-08-25 09:42:20,没有持盘对抗，对比足球篮球这些
127255309632 ,555434722,13615200,0,1661358063,2022-08-25 00:21:03,这也太激情了
127114251760 ,555434722,11413191,1,1661286311,2022-08-24 04:25:11,为什么只有白色的飞盘[思考]
127063823440 ,555434722,18022186,1,1661257693,2022-08-23 20:28:13,国内这样还不得起来补个妆啊[妙啊]
126998158592 ,555434722,1438373891,0,1661229531,2022-08-23 12:38:51,不是非得穿瑜伽服啊
126824908592 ,555434722,92257297,0,1661134931,2022-08-22 10:22:11,规则是啥啊
126823004688 ,555434722,1328589472,2,1661133902,2022-08-22 10:05:02,如果现在中国足球场上都能是这种水平和强度的飞盘，那我肯定不会再去诋毁飞盘，而且可能也会喜欢。但是你们看看现在国内玩飞盘的有多少是正经运动的。又有多少是拍照的，泡妞的。
126653421056 ,555434722,14238782,5,1661035619,2022-08-21 06:46:59,好笑，你们会笑别人用棒球只玩抛接吗？这个狗也会，也没有对抗性，也符合你们眼里的“不尊重运动”啊？还搁这儿为什么讨厌“飞盘媛”，因为你们自觉高人一等是搞运动的看不起只是玩游戏的呗，上一句还在扯尊不尊重扯大旗，下一句就是“宾馆加时赛”暴露自己的档次，听话噢，别装了，再装自己都信了。
126633426256 ,555434722,272063065,0,1661011635,2022-08-21 00:07:15,好帅！！！有没有入门教程，please[脱单doge]
126606926912 ,555434722,2647783,0,1661001842,2022-08-20 21:24:02,今年才知道这东西，公司每周二四都会有公费运动，之前是羽毛球篮球偶尔足球，飞盘是今年加进来的[藏狐]
126553200752 ,555434722,379286685,0,1660979389,2022-08-20 15:09:49,好几年前加拿大高中体育课就有飞盘了
126488760432 ,555434722,89408088,15,1660936085,2022-08-20 03:08:05,众所周知，狗叼的最多的是网球，是不是网球也是狗玩的？狗也吃饭你也吃饭，你俩是不是同类？
126476732192 ,555434722,2645808,1,1660926298,2022-08-20 00:24:58,别的不说，飞盘这项运动是男女皆可参加的集体运动，对女性来说真的非常友好，而足球野球，女生完全无法和男生同台竞技，非常非常容易受伤，除非你能凑出女队来，但出了象牙塔基本没可能。所以飞盘真的很好，不要因为个别人的行为歧视这项运动和参与的人。
126296782240 ,555434722,6998487,3,1660831265,2022-08-18 22:01:05,"飞盘国外火了好久了[笑哭]
视频里这种激烈对抗的太专业了，对标的是不允许冲撞的橄榄球。轻松的就是大学里很多人在草坪上几个人互相扔聊聊天，路过的人打个招呼也能一起玩。单纯就是项健康的运动。
七八年前国内我们同学就开始玩了，不知道为啥最近突然火了，还变得不太一样了[辣眼睛]"
126288234800 ,555434722,86026687,0,1660828182,2022-08-18 21:09:42,怎么没有瑜伽裤[doge]
126254306480 ,555434722,671009435,6,1660814789,2022-08-18 17:26:29,弹幕有人急了 但是我不说是谁 偏见这块狠狠拿捏???
126253671920 ,555434722,7282176,1,1660814555,2022-08-18 17:22:35,打篮球、橄榄球是因为人家身体素质到了，才能享受到身体对抗、技巧博弈的快感。身体素质不到这个运动就玩不明白。
126251233600 ,555434722,524918468,16,1660813461,2022-08-18 17:04:21,这比赛要是派上一条哈士奇，是不是无敌了？
126150214832 ,555434722,104478847,1,1660748021,2022-08-17 22:53:41,别什么羽毛球都要跟足球比运动量了，也不是没打过羽毛球，经常变相控制步伐确实累，但是你感觉很累不代表运动量比足球大，反过来说，那些觉得羽毛球比足球运动量大的人，你扪心自问你踢足球多长时间，对足球又多少了解，自己去查查足球和羽毛球比赛的周期各多少再敲键盘
125850686432 ,555434722,520429726,0,1660578005,2022-08-15 23:40:05,我们学校开的飞盘课就是给不能正常上一般体育课的同学的，运动强度也不是很大，没必要用这种专业的和普罗大众业余的相比吧。谁平时跑步还得照着博尔特的水平跑呢？
125850455472 ,555434722,23126055,3,1660577926,2022-08-15 23:38:46,所以我看国内跟风的年轻男女站着飞两下，没有飞扑没有狂奔的飞盘运动，在我看起来就跟你拍一我拍一一样[OK]
125823237328 ,555434722,32041782,0,1660567935,2022-08-15 20:52:15,他们也是在足球场啊[滑稽]
125809765536 ,555434722,415518098,2,1660562750,2022-08-15 19:25:50,上半场飞盘，下半场酒店
125787211872 ,555434722,239865575,0,1660553754,2022-08-15 16:55:54,没有瑜伽裤小背心，一看就不专业
125635241024 ,555434722,8275216,0,1660468263,2022-08-14 17:11:03,这个和橄榄球有点像吧
125627893408 ,555434722,72502426,1,1660464972,2022-08-14 16:16:12,我只见过狗叼飞盘，人玩飞盘。。。[辣眼睛]
125600925616 ,555434722,1286413452,0,1660452651,2022-08-14 12:50:51,国内要是真玩成这样，那也很好，现在就是社交活动
125599184704 ,555434722,251501427,0,1660451990,2022-08-14 12:39:50,有无懂哥讲下规则
125292822240 ,555434722,21702478,2,1660285723,2022-08-12 14:28:43,飞盘一开始确实不是给狗玩的哦。但是现在国内玩的很多确实是狗。[脱单doge]
125283237056 ,555434722,393483121,0,1660281499,2022-08-12 13:18:19,自己的运动应该有自己的场所，老占足球场干什么
125280374080 ,555434722,668056778,1,1660280414,2022-08-12 13:00:14,台湾那边有专业玩这个的，我看过几场，贼帅，而且还是世界水平的
125224009376 ,555434722,33091325,0,1660236165,2022-08-12 00:42:45,这穿短裤短袖一看就不专业啊
125188830112 ,555434722,386987585,1,1660222540,2022-08-11 20:55:40,视频里的大家肌肉都好漂亮啊
125187891328 ,555434722,332695209,0,1660222196,2022-08-11 20:49:56,咋人玩上了[思考]
125143539120 ,555434722,13679715,0,1660204514,2022-08-11 15:55:14,我的评价是不如棒球
125098028416 ,555434722,244052023,0,1660184880,2022-08-11 10:28:00,原来飞盘是这么玩 的啊
125065556912 ,555434722,418181,0,1660149760,2022-08-11 00:42:40,看起来有点像变版的美式足球？[思考]
125047483376 ,555434722,39783267,0,1660142320,2022-08-10 22:38:40,隔壁up理娱打挺疼，三观歪到爆炸，看的我血压飙升！https://www.bilibili.com/video/BV1Jv4y1T73o
125020957904 ,555434722,35590636,0,1660132712,2022-08-10 19:58:32,哇，好酷啊
124966537872 ,555434722,34560872,0,1660109139,2022-08-10 13:25:39,"只要是运动我都觉得累
你们不要在吵了
我现在运动也就呼吸了[doge]"
124950973376 ,555434722,576806717,1,1660103067,2022-08-10 11:44:27,真要都这样玩飞盘，愿意顶着三四十度高温去跟我们抢球场也行[doge]
124943625856 ,555434722,1858158469,1,1660099749,2022-08-10 10:49:09,https://b23.tv/BV1Ba411T7Zd 蚌埠住了
124932380560 ,555434722,30858682,0,1660093727,2022-08-10 09:08:47,"虽然但是膝盖和脚踝扭伤是真的疼啊（送外卖，扭伤在家躺了一周了）
对：不怕受伤的兄弟们"
124930254096 ,555434722,352994371,0,1660092288,2022-08-10 08:44:48,（本人小众运动爱好者）其实确实是因为这种运动进入大众视野的时候就是以动物和不太正面的运动形象（比如某些女性运动时胸部都没有固定，走起来都会晃，没有打拳的意思，本人也是有胸的，之前学习参与过棒球蹦床体操羽毛球等，不固定胸部真的会特别难受，会疼的，所以没有固定，还增大的那些人是真的没想过要跑起来的）我在芬兰学习的时候最开始接触的定点飞盘，无性别年龄要求，老师学生一起玩，后来才玩的对抗赛。真的感觉没什么就是好玩，定点飞盘三五个人都能玩，一玩一下午。对抗赛我们也要跑，要飞扑也会受伤，而且飞盘还有型号区分，我在的比赛有要求对抗赛不能用的飞盘类型，因为不同形状的飞盘有不同的特点，比如有的飞行速度和距离大，有的就是飞行距离一般滞空时间长，（反正那个学校大概有两百多个飞盘，第一节课就学习规则和选飞盘）所以这个运动其实是规则完善的运动，但是现在很明显有人就本能黑本能排斥，我们也没办法，所以就去那种花钱租的球场，反正我花钱租的，那段时间就是我的，我玩什么你没有资格评价
124892351312 ,555434722,13145622,0,1660056277,2022-08-09 22:44:37,飞盘应该是轻量级橄榄球吧
124885889216 ,555434722,440800114,0,1660054053,2022-08-09 22:07:33,好爽啊
124875915104 ,555434722,385553475,1,1660050564,2022-08-09 21:09:24,为什么会出现飞盘媛、健身媛我相信也是有原因的，虽然我很不喜欢媛、婊、茶这一类女性贬义的专属名词，但是确实在这些活动当中能够看到一些女性没有认真训练（相比于男性而言占比会多一点），而且女性对于拍照分享精致生活的分享欲会更强烈，所以更引战一些吧。但是我很想再往背后思考一下原因，自从前两年开始健身以及今年开始培养骑行爱好之后，我深刻地意识到从初中时候开始，整个社会对于女性在运动社会认可方面降低到极低的水平（我相信在小学时期大家好动或者静都还不是那么性别分化的特征），导致我们能看到一群男孩从小到大一直保持着良好的运动爱好，篮球、足球、游泳等等吧，看看有多少男孩子的爱豆是篮球明星，而有多少女孩子的爱豆是运动明星呢？而我认为文化（专指精神方面）和运动，是同等重要的，我们应该在社会层面上有这样宏观的推进，让大家慢慢发现不仅运动的男孩是有魅力的，女孩也一样，不要这样单一的审美，那么自然而然愿意去运动的女孩就对了，发自内心的喜欢这项活动，就不会有那么多肤浅的打卡行为。以上
124852798976 ,555434722,1771868,3,1660041951,2022-08-09 18:45:51,足球场本来就是多功能用途的，美国扬基球场主打棒球，但是也可以打橄榄球比赛，国外飞盘也基本是通用足球场和橄榄球场，因为需要的条件一样，长宽符合的草地就够了。而且就算是专门的足球比赛场地，老子花钱定了，我躺着冥想都不关别人事。觉得人家抢你位置你就早点订。没订到怪别人是什么逻辑。
124826131232 ,555434722,167882905,0,1660030941,2022-08-09 15:42:21,可是这看起来很好玩啊！
124823683760 ,555434722,495047661,1,1660029677,2022-08-09 15:21:17,我寻思国外那么开放，也没见的穿吊带，瑜伽裤玩飞盘的啊，原来是因为国外是真的为了玩飞盘啊
124814337936 ,555434722,382144396,0,1660025109,2022-08-09 14:05:09,玩飞盘可能还真是狗狗更擅长[笑哭]
124787219312 ,555434722,458006468,0,1660013635,2022-08-09 10:53:55,原来飞盘是个对抗体育项目
124782176896 ,555434722,677041980,0,1660011046,2022-08-09 10:10:46,@杨花大桥-- 来看真正的飞盘[脱单doge]
124777970608 ,555434722,344726654,0,1660008720,2022-08-09 09:32:00,国内哪有那么多球场啊[大哭]
124766522976 ,555434722,442513212,1,1659999237,2022-08-09 06:53:57,国内踢足球的要是有欧洲业余水平也不会有人在足球场上玩飞盘了
124766276224 ,555434722,547936129,0,1659998710,2022-08-09 06:45:10,这不就是外接手和四分卫的游戏吗
124746841712 ,555434722,437176855,0,1659973953,2022-08-08 23:52:33,这么说吧，配这样的BGM而我丝毫感觉不到激烈感
124733312416 ,555434722,1823604,0,1659968717,2022-08-08 22:25:17,旺财，去捡回来
124729254912 ,555434722,27942179,0,1659967286,2022-08-08 22:01:26,没兴趣
124727043296 ,555434722,38263901,0,1659966460,2022-08-08 21:47:40,干嘛不搞个大球门 这样子来回跑有啥意思
124722836992 ,555434722,265097110,0,1659964940,2022-08-08 21:22:20,接的时候虽然接到了不也触地了吗？
124705546928 ,555434722,13295075,0,1659958219,2022-08-08 19:30:19,第一次知道这种运动！好厉害
124704764480 ,555434722,397942659,0,1659957961,2022-08-08 19:26:01,我想问，飞到人脸上咋办
124680570000 ,555434722,593916,0,1659948327,2022-08-08 16:45:27,真的没有穿瑜伽裤的呀?
124659091936 ,555434722,451036418,0,1659937556,2022-08-08 13:45:56,我的讨厌的是飞盘缘吗？是不能玩飞盘缘
124625595312 ,555434722,19397034,1,1659922349,2022-08-08 09:32:29,很像丢沙包啊会飞的沙包
124612939408 ,555434722,39283328,0,1659909998,2022-08-08 06:06:38,哎呀呀，注意安全，这个太危险了，一不小心就会瘫痪的[doge]
124609889696 ,555434722,3494744,0,1659900586,2022-08-08 03:29:46,感觉容易受伤，看起来动作很自由，又总是需要跳，抢，摔死，好害怕胳膊受伤
124598951248 ,555434722,1083968180,0,1659890037,2022-08-08 00:33:57,这不就是对抗弱化橄榄球吗？
124581361728 ,555434722,612227,0,1659882830,2022-08-07 22:33:50,气抖冷，为什么视频中没有一个中国队伍？（没看完，若说错请轻喷[脱单doge]）
124546189088 ,555434722,88530786,0,1659869063,2022-08-07 18:44:23,不行，这样玩她们假体都会摔出来[大笑]
124534037760 ,555434722,484954653,0,1659864042,2022-08-07 17:20:42,和netball很像
124493727328 ,555434722,487114540,1,1659845324,2022-08-07 12:08:44,这才是飞盘的正常玩法，不像国内那群女的，穿着紧身瑜伽服去秀身材，哪有一点运动气息
124490561536 ,555434722,315306074,1,1659843999,2022-08-07 11:46:39,所以强度这么大的运动真的适合男女混合吗[微笑]
124469858320 ,555434722,19519038,1,1659833517,2022-08-07 08:51:57,接的没狗好  接的没狗远  接的没狗快  接的没狗高
124457958048 ,555434722,437281897,41,1659813676,2022-08-07 03:21:16,某些狂热dog们，只要场地是人家花钱租的就算人家在规定时间内什么都不干就躺里面睡觉你也管不着呢，别叫唤什么足球场地租了就要踢足球，又不是买断了不让你租[思考]而且国内足球氛围也没多好吧？[思考]在你租场子踢球的时候不也没有多少玩飞盘的乱咬[抠鼻]本来就没有对错的事就因为别人租了跟你没一丝关系的场地你就要开火吗
124431423696 ,555434722,420415385,2,1659796968,2022-08-06 22:42:48,"刚知道还有这项运动，以前一直以为是训狗的[笑哭](没有侮辱的意思)
感觉很好玩啊，有机会的话我想试试"
124419420416 ,555434722,486410366,0,1659792567,2022-08-06 21:29:27,不好玩
124403162656 ,555434722,4511280,2,1659786204,2022-08-06 19:43:24,草地，尤其是人工草坪，一定要带护具。夏季高温擦伤是可以到烫伤级别的。。。非常容易留疤
124396337072 ,555434722,14095159,2,1659783469,2022-08-06 18:57:49,不出意外的话 国内大多数的草地还真不适合玩这个
