comment_id,av,id,like,时间戳,time,comments
118812612256 ,385486211,413404961,0,1656565525,2022-06-30 13:05:25,去看看美式橄榄球   女版[doge][doge][doge]
118808406832 ,385486211,12485044,2,1656563527,2022-06-30 12:32:07,我想不通为什么有人不喜欢瑜伽裤，我有个同事上班经常穿，大家都可开心了
118803743408 ,385486211,1670214270,0,1656561472,2022-06-30 11:57:52,飞盘有什么看头？
118795579728 ,385486211,1387641,6,1656556735,2022-06-30 10:38:55,本来就没那么多玩飞盘的，不知道哪里冒出来的。
118795428736 ,385486211,437745807,0,1656556609,2022-06-30 10:36:49,场上热身，场下运动
118794211424 ,385486211,4164257,0,1656555803,2022-06-30 10:23:23,我不讨厌，只要不影响别人就行。
118790156608 ,385486211,13692546,0,1656553046,2022-06-30 09:37:26,大学选修课不都有飞盘很常见啊，只是拍照的离谱罢了[妙啊]
118786370848 ,385486211,859292,0,1656550073,2022-06-30 08:47:53,快找胡锡进来！
118782565648 ,385486211,390940629,0,1656546344,2022-06-30 07:45:44,几级了
118780589360 ,385486211,415867033,1,1656543698,2022-06-30 07:01:38,找一个动漫，应该是国产的，应该是12年金鹰卡通，应该是反派，白色的龙，可以变形成人形，变的时候，右手变成龙头，左手是龙尾，变形金刚机甲类型，就这点印象，求求各位了，先说好，不是变形金刚，不是元气星魂，不是超兽武装
118774833312 ,385486211,53229196,0,1656527859,2022-06-30 02:37:39,找个台湾节目，是儿童益智类节目，几个小孩闯关的，里面好像还有个会说话的树？大概是2000年左右的，小时候看过碟片，忘记叫什么名字了
118772470752 ,385486211,520016324,0,1656524806,2022-06-30 01:46:46,Up可以帮我找一个动漫吗[委屈]，是日本的，我只记得一个女生她好像可以变成另一个人格，每次变成另一个人格的时候背景好像都有血，其中有一集她好像是吃鱼，而且吃了好多，衣服整体都是红色粉色，非常感谢[保佑]
118771194960 ,385486211,165560359,0,1656523603,2022-06-30 01:26:43,能找部漫画吗[tv_大哭]就是讲的未来一所保镖学校里三个见习保镖的故事，两个男生一个女生，男生是黑头发和白头发女生是粉头发[2233娘_委屈]求求了
118770411168 ,385486211,29783386,0,1656522822,2022-06-30 01:13:42,不存在只要你玩，穿什么都可以
118768802704 ,385486211,22539583,0,1656521566,2022-06-30 00:52:46,给10不给0
118765145520 ,385486211,145018900,333,1656519401,2022-06-30 00:16:41,其实“媛”这个汉字在中国文化中是个美好的字眼，还是希望大家不要污名化这个字
118763935600 ,385486211,10078574,13,1656518736,2022-06-30 00:05:36,所以我们的足球永远起不来，不是跳广场舞就是玩其它七七八八
118755342192 ,385486211,66029041,0,1656514770,2022-06-29 22:59:30,他不拍你拍啊[doge]
118752965888 ,385486211,39455986,0,1656513696,2022-06-29 22:41:36,扛着摄像机补光灯去运动[doge]
118751287664 ,385486211,1410424757,0,1656512973,2022-06-29 22:29:33,新型钓凯子
118750454144 ,385486211,1999918619,0,1656512666,2022-06-29 22:24:26,瞎哥帮我找个电影是两个男人开车去度假什么的
118749408288 ,385486211,4424894,0,1656512212,2022-06-29 22:16:52,你猜为什么偏偏飞盘火起来了，因为它可以够潮
118748390960 ,385486211,492912774,0,1656511784,2022-06-29 22:09:44,阿婆，想找一部小时候看的动漫，好像是三个神仙，一个叫老什么什么，一个叫小什么什么，就这点印象了[难过]
118745434800 ,385486211,24606347,34,1656510509,2022-06-29 21:48:29,飞盘爱好者我能理解 所以足球爱好者不是人？ 占着足球场叫着我也是热爱这个运动 那我们不热爱足球？热爱运动本质上都没错 但是你猜为什么足球配得上专门修个场 飞盘不配
118743620352 ,385486211,449721332,14,1656509647,2022-06-29 21:34:07,想找一部日剧，男主多年前失去了姐姐，于是在报纸上刊登寻找姐姐的文章，然后女主假扮他的姐姐，之后在相处的过程中男主应该是爱上了这个假姐姐，但是男主好像有女朋友。而且女主超级美，长直发，这应该是悬疑剧，剧名好像是两个字。拜托拜托，如果不合适麻烦说一声我会删掉[委屈][委屈]
118743532144 ,385486211,354384707,1,1656509600,2022-06-29 21:33:20,upup，可不可以帮我找一部动画电影，开场讲述男主在一个有家暴倾向的家庭中  其父亲在勒死母亲后被小时候的男主用意念力一样的东西操控自己上吊  多年后又在世界各地组织了数名跟他一样的有超级头脑的少年（有男有女），并且这几个少年在男主的选秀上不认识大家的情况下找到自己的“同类”后面剧情记不清了[脸红]
118742632768 ,385486211,28897863,0,1656509262,2022-06-29 21:27:42,我一直以为是要拿S686打飞盘
118741802272 ,385486211,269378535,0,1656508879,2022-06-29 21:21:19,up！up！想找一个电影 女主是中国人，然后男主是外国人，然后男主因为上战场死掉了，有个镜头，是他们两个在一起跳舞   女主穿着旗袍 看着就是很漂亮那个电影叫什么名字来着？
118737130032 ,385486211,9209470,0,1656506672,2022-06-29 20:44:32,我真好烦这种到处搞擦边的
118736527008 ,385486211,63987278,8,1656506443,2022-06-29 20:40:43,前段时间参加过一次飞盘活动，的确看到不少女性玩家全程三分二的时间都在拍照，但只要不影响我们活动，基本都不会管
118736448256 ,385486211,35611485,0,1656506380,2022-06-29 20:39:40,推销罢了[doge]
118734188560 ,385486211,11739394,0,1656505299,2022-06-29 20:21:39,为什么我没关注，也出现在了我动态里
118726823904 ,385486211,274412159,4,1656501790,2022-06-29 19:23:10,@胡锡进
118725525904 ,385486211,442160710,0,1656501179,2022-06-29 19:12:59,飞盘也是一项运动的[辣眼睛]这都能有飞盘猿是我没想到的
118724787200 ,385486211,385312913,1,1656500894,2022-06-29 19:08:14,足球场[doge]
118721359008 ,385486211,580014387,0,1656499320,2022-06-29 18:42:00,我想这跟足球一样，难发展，这个看国外视频的时候感觉非常刺激，又不需要足球那样需要很多技巧
118720346880 ,385486211,10818088,0,1656498781,2022-06-29 18:33:01,欢迎人援和我对线[doge]
118719425888 ,385486211,507394,0,1656498369,2022-06-29 18:26:09,是的，合在一起味儿就不对了。详情请参考五仁月饼
118719344480 ,385486211,285910119,0,1656498343,2022-06-29 18:25:43,虾弟俺找游戏，大概2010年以前在电脑上玩的，就是像迷宫一样需要把阻挡路的木头砍掉什么的才能通关，具体怎么玩忘记了，画风很唯美好像是外国那种游戏，不是像素人的，如果没记错的话里面的背景音乐《森林狂想曲》是其中之一，好像是可以下载到桌面的单机（不确定）游戏，好像是带关卡的记不太清了但是会有春夏秋冬，好像还有是前面有木头需要砍伐开路的（不是失落之城）
118719395792 ,385486211,16364121,0,1656498330,2022-06-29 18:25:30,各类改造的飞盘运动老少咸宜，是很不错，很健康的运动主题，请少些营销，不要影响真正热爱运动的人
118719005424 ,385486211,400063926,2,1656498191,2022-06-29 18:23:11,抵制的永远是一类人而不是运动，有些人就是不明白来指指点点占领舆论制高点
118714740208 ,385486211,286369894,0,1656496060,2022-06-29 17:47:40,2号很棒！
118714474576 ,385486211,15438701,0,1656495938,2022-06-29 17:45:38,为什么讨厌？真不爱看啊？
118714145536 ,385486211,354639094,0,1656495772,2022-06-29 17:42:52,正确的，中肯的
118714002880 ,385486211,594013866,1,1656495666,2022-06-29 17:41:06,飞盘不就给狗玩的嘛[吃瓜]
118714000336 ,385486211,90952527,0,1656495662,2022-06-29 17:41:02,指定是有点副业
118713808368 ,385486211,413311856,0,1656495612,2022-06-29 17:40:12,我小学的时候玩过飞盘这个运动，那时有一次还拿错了，拿的套圈柱子的底座飞出去了哈哈哈哈哈，结果就我的飞得最稳最好追。[滑稽][滑稽][滑稽][滑稽][doge]
118713734304 ,385486211,24277481,1,1656495506,2022-06-29 17:38:26,我就说我朋友圈一个玩飞盘的，合照都是俊男靓女
118710311264 ,385486211,11204799,0,1656493654,2022-06-29 17:07:34,有些人的评论不太友好啊
118709425200 ,385486211,286708188,1339,1656493087,2022-06-29 16:58:07,我们上周天踢球 有三个姑娘带着摄影师来拍照片 场地是我们花钱租的 看几个女的我们也没说什么 就是让瞅着点 别让球踢了 然后踢下半场我们队有个带球边线突破 俩女的在那自拍 队友也没看清 就撞上了 那就一个字 惨
118708080736 ,385486211,3999979,0,1656492218,2022-06-29 16:43:38,看来我的层次还不够高呀，身边都没听说有这样的猿
118701067056 ,385486211,520266686,0,1656487547,2022-06-29 15:25:47,是为了服务增值还是扩展消费渠道？咱也不知道[藏狐]
118700283872 ,385486211,173969764,1,1656487063,2022-06-29 15:17:43,为什么飞盘要与草坪绑定从而侵占足球场，你既然强调无对抗，无身体接触，哪玩不行？打篮球比你激烈多了，基本都在水泥地上
118697232992 ,385486211,108546270,0,1656484909,2022-06-29 14:41:49,自己物化自己[嗑瓜子]
118695890912 ,385486211,470008077,0,1656484007,2022-06-29 14:26:47,@胡锡进
118695325504 ,385486211,22475119,0,1656483637,2022-06-29 14:20:37,我上小学时就有玩飞盘的，大概流行了三四年左右，我印象是93-96年前后，我家杂物间现在应该还有一两个飞盘，那时的玩法好像大多数是视频里提到的第一种玩法和丢沙袋的结合体
118694966352 ,385486211,241105609,0,1656483390,2022-06-29 14:16:30,其实和家里小孩子一起玩挺好的
118694384256 ,385486211,478356005,0,1656483076,2022-06-29 14:11:16,疫情不好接活，这不，b站直播区突然多了很多KTV从业人员[吃瓜]
118694376800 ,385486211,8699665,0,1656483061,2022-06-29 14:11:01,其实，dddd，商品展示而已
118692433936 ,385486211,393310482,0,1656481834,2022-06-29 13:50:34,哈哈哈，虽然很多内容刺耳难听，但是说出来了大家都知道的心知肚明
118690711008 ,385486211,399318782,1,1656480840,2022-06-29 13:34:00,我觉得主要因为他碰瓷的是足球吧，碰瓷足球可不是什么好事，虽然大部分球迷都不会看什么网络不会像什么LOL评价，但群体基数在中国也是很大的，你要想不止有中国对球迷，大部分基本上都看五大联赛的
118690670672 ,385486211,3822631,1,1656480771,2022-06-29 13:32:51,扔橄榄球不比这玩意带劲？腰旗橄榄球比这好玩
118689740128 ,385486211,1988451,0,1656480276,2022-06-29 13:24:36,我想边玩边拍照，美美的记录飞盘时候的自己，不盈利呢?
118687949600 ,385486211,1979135357,1,1656479338,2022-06-29 13:08:58,现在话不严谨都要被喷死
118687807808 ,385486211,402110843,0,1656479251,2022-06-29 13:07:31,抛开事实不谈，我有罪[doge]
118687537648 ,385486211,11614229,0,1656479090,2022-06-29 13:04:50,稍机
118687460832 ,385486211,487937263,0,1656479081,2022-06-29 13:04:41,14年时候高中体育课就有飞盘，怎么现在又火起来了[藏狐]
118687007024 ,385486211,602952851,1,1656478883,2022-06-29 13:01:23,UP甲叠满了依然防不住弹幕硬杠
118686905488 ,385486211,22418956,0,1656478767,2022-06-29 12:59:27,那些网红就纯拍照去的……等出来下一个火的又嚯嚯下一个去了
118686106512 ,385486211,294049023,1,1656478422,2022-06-29 12:53:42,让时间再沉淀沉淀，市场会给出相对准确的结果，足球经过了历史考验了，它呢，等市场自我自我调整就好了[tv_点赞]
118684500688 ,385486211,50761128,0,1656477660,2022-06-29 12:41:00,像我这种又踢球又飞盘 哪边占上风我帮哪边[doge] （不过我们飞盘都是出钱包的私人球场 不占用足球公共资源）
118681696976 ,385486211,23481113,1,1656476351,2022-06-29 12:19:11,讲的真好
118680805440 ,385486211,11549708,12,1656475912,2022-06-29 12:11:52,飞盘从一个极小众运动突然大火 在一二线城市迅速发展 背后肯定有推手啦 而且我是想不通飞盘有什么帅的 你可以去玩腰旗橄榄球 女生带上手套头巾比拿这个飞盘帅多了
118679106080 ,385486211,234089923,0,1656475154,2022-06-29 11:59:14,_就是_五颜六色还是_
118679081728 ,385486211,79850041,0,1656475115,2022-06-29 11:58:35,大学里选足球的妹子还是挺多的，但是篮球更多[大哭]
118678398976 ,385486211,30346260,0,1656474772,2022-06-29 11:52:52,如果每个人都像你这样思路清晰的开喷，这世界就太正常的不合理了。
118677596656 ,385486211,5603496,1,1656474358,2022-06-29 11:45:58,到位
118676561792 ,385486211,452365536,1,1656473674,2022-06-29 11:34:34,玩这个还不如玩英式橄榄球
118675992864 ,385486211,159443682,0,1656473456,2022-06-29 11:30:56,休闲鞋还好吧，我打羽毛球也是穿休闲鞋的，除非跟朋友约了，需要认真打才会带球鞋，平时只是随便玩的话感觉休闲鞋够用的。也可能我们对休闲鞋和运动鞋概念不一样，我觉得休闲鞋就是运动鞋。
118675489824 ,385486211,258544275,0,1656473143,2022-06-29 11:25:43,鄙人还真尝试过极限飞盘，基本就是短跑专项训练。对普通人极度不友好。
118675487152 ,385486211,275952378,1,1656473138,2022-06-29 11:25:38,这不就是山寨橄榄球
118675029232 ,385486211,12716793,0,1656472897,2022-06-29 11:21:37,说实话，飞盘这东西我前几天才知道的，之前一直都是以为只有狗才玩
118675056320 ,385486211,13417764,3,1656472842,2022-06-29 11:20:42,这些人被骂原来不是因为占用足球场地啊，我看都是在足球场玩的，那踢足球的人去哪呢…感觉就像篮球场被广场舞大妈占了的感觉…
118673117440 ,385486211,93945159,1,1656471776,2022-06-29 11:02:56,不懂就问，这难道不是给狗玩的吗
118673039584 ,385486211,19722740,1,1656471717,2022-06-29 11:01:57,他真的太严谨了，我哭死
118672706528 ,385486211,33004389,0,1656471469,2022-06-29 10:57:49,我觉得挺好的[doge]
118672270944 ,385486211,1325568090,1,1656471177,2022-06-29 10:52:57,我记着西交利物浦大学的一个特色就是飞盘
118670925408 ,385486211,20147996,0,1656470298,2022-06-29 10:38:18,有人说运动量少，我不能理解，在场上是走路不跑位的？
118669723504 ,385486211,2512872,0,1656469481,2022-06-29 10:24:41,我感觉男女能一起玩的团体运动本质就是社交，滑雪群转飞盘和路冲了，但套路都是一样的[捂脸]有几个是正经练活儿的啊
118669342320 ,385486211,509295758,0,1656469256,2022-06-29 10:20:56,问一个动漫，主角团是两个男的，一个女的，还有一个不知道怎么物种，故事发生在地下，主角的父亲在地下遇到了危险，用类似于一把枪一样的东西中间有玻璃瓶样的东西用来装精灵把一只橙色的精灵发射出去（精灵在被枪发射出去时会变大变强），主角很爱给那些精灵取名字（我记得其中有一个会发射蛛网的叫纺织手），主角们有机械兽用来赶路的，（没记错的话有一只犬（白色）一只狼（蓝色）一只牛（绿色）一只驴（忘了什么色），那只牛的主人是个大块头（会修机械兽，他们的机械在他的改装下会变成车，有一辆摩托车，一辆越野车，其他的不记得了）精灵可以自己从野外抓，也可以打比赛获得。有一个坏人他用黑色的东西使得精灵变的凶残，主角有个精灵好像叫博士，可以治疗那些变坏的精灵。有一集，一个小孩给了主角一只精灵，那只精灵在被枪发射出去后身上变出了几个透明的小球（球有些小凸起）那些小球是炸弹，等到精灵变回原来的样子时，只要把头上的两个触角碰在一起就可以把炸弹引爆。麻烦有知道的可以告诉我，谢谢！
118668812928 ,385486211,26190694,0,1656468821,2022-06-29 10:13:41,我们大学学校主打的就是飞盘，可是我们班人少根本没得选
118668085136 ,385486211,87642389,0,1656468303,2022-06-29 10:05:03,"08年我就看到有老外在世纪公园足球场玩飞盘了 那个时候旁边的足球小场租金还是300一小时 都是老外在玩 运动量很大 
后来我也和我们朋友玩过 国际上也有专业比赛 不是狗叼盘子的游戏
现在推广也多了 希望能好好的玩别搞歪了"
118667510304 ,385486211,14556757,0,1656468050,2022-06-29 10:00:50,求一个电视剧名，虾虾看下私信[妙啊]
118666655008 ,385486211,27391643,7,1656467293,2022-06-29 09:48:13,在足球场玩不是足球的东西已经够离谱了[呲牙]
118666654080 ,385486211,25359664,0,1656467291,2022-06-29 09:48:11,?虽然但是。。。还真不知道有这运动。。
118665381632 ,385486211,396466710,8,1656466336,2022-06-29 09:32:16,玩不玩飞盘 没人管你 就是别占足球场地
118665146240 ,385486211,2988815,0,1656466169,2022-06-29 09:29:29,好多人是真不知道得体是什么意思啊，你在娱乐场所休闲场所这么穿没问题，我也爱看，但在寺庙，运动场，学校这么穿就叫做不得体。运动本来是件好事，一帮猿在那拍来拍去，心思就不在运动上，队友也毫无体验。别杠，刚就是你没受过教育
118663418448 ,385486211,4752245,23,1656464911,2022-06-29 09:08:31,又来污名化？！
118662161008 ,385486211,1394597616,0,1656463769,2022-06-29 08:49:29,找一首歌英文的，在网易云听到的，大概七个及以上个字母，封面是一个黑色卫衣的外国男生，大概有一段歌词 是这么说的 “why why why move”只是听起来像，也可能是where
118661971984 ,385486211,35785044,7,1656463693,2022-06-29 08:48:13,飞盘？好像是给过玩的来着。遛狗的
118661811664 ,385486211,8251409,93,1656463503,2022-06-29 08:45:03,我讨厌所有占足球场不踢球的人
118660745760 ,385486211,482327126,0,1656462562,2022-06-29 08:29:22,虾哥，找一个动画片，小时候看的，就记得其中两集，有一集是男主想一只过生日，就做了一个催眠仪，对爸爸妈妈一直催眠，导致每天都是生日，然后邻居甚至没有礼物送给他了，后面有点忘了，还有一集是男主有一个遥控器一样的东西，好像是能把一些东西还原，然后男主他爸就拿着这玩意去餐厅吃汉堡，吃一个还原一次，不停的重复，旁边人都看傻了，然后男主一伙人又穿越到了远古时期，被恐龙追，男主就用木牌树枝还有一些浆果做出来遥控器，穿越回来了[doge]
118659273904 ,385486211,345719550,1,1656461136,2022-06-29 08:05:36,飞盘这么火为什么不建专门的场地呢？这样搞其他运动的也就没意见了呀
118659087616 ,385486211,20566797,0,1656460984,2022-06-29 08:03:04,up，up，超感摩托有课是啥意思啊[疑惑]
118657071904 ,385486211,40523176,0,1656458378,2022-06-29 07:19:38,不不不，你搞错了，我并不讨厌，挺好看的
118656649968 ,385486211,609655193,0,1656457708,2022-06-29 07:08:28,home是什么梗啊啊啊
118656193584 ,385486211,291612192,12,1656456985,2022-06-29 06:56:25,玩飞盘就算了，还占用足球场，我们这些踢足球的都没地方去了[辣眼睛]
118655739024 ,385486211,331426361,22,1656456161,2022-06-29 06:42:41,带动了酒店行业的发展，我大力支持这种运动
118655423760 ,385486211,43617060,0,1656455608,2022-06-29 06:33:28,飞盘虽圆，但也不比那些扔飞盘的圆，圆的对碰，现在的模式就是什么地方能搞怪有流量有关注度就往什么方向发展，逐步的网红起来
118654342832 ,385486211,639768286,0,1656452047,2022-06-29 05:34:07,"help 帮帮忙 我之前听到一首很好听的日文歌
想不起名字了 然后旋律是 da da，da da，da da da ohoh 一k娜me Day  还有 warma 翻唱过"
118653809664 ,385486211,159204446,0,1656449793,2022-06-29 04:56:33,我还以为是千里送的那种[微笑]
118653733696 ,385486211,142726142,0,1656449512,2022-06-29 04:51:52,不搞才怪
118652735504 ,385486211,393115803,0,1656445686,2022-06-29 03:48:06,飞盘挺好玩的
118652293840 ,385486211,37970961,0,1656444638,2022-06-29 03:30:38,感觉玩这个好累……
118651638768 ,385486211,389537723,1,1656442921,2022-06-29 03:02:01,追根溯源 还是博流量， 流量 = 利益[吃瓜]
118651018336 ,385486211,490947466,2,1656441949,2022-06-29 02:45:49,我们体育课（定向)丢翻盘就是占的足球场[tv_doge]
118650705936 ,385486211,64666562,0,1656441318,2022-06-29 02:35:18,全是甲，几乎没有血条[脱单doge]
118649870288 ,385486211,20838719,0,1656440034,2022-06-29 02:13:54,等一手高铁援[吃瓜]
118649753072 ,385486211,101704003,0,1656439978,2022-06-29 02:12:58,反正流量获得的效益总是要落入某些人手里，我看美女怎么了。。。有些人不要把自己当做太重要的人，不然美女给我秀那你给我秀？
118649014576 ,385486211,24420691,0,1656439002,2022-06-29 01:56:42,[doge][doge]
118648644032 ,385486211,27789422,0,1656438441,2022-06-29 01:47:21,up头像好评！
118648307504 ,385486211,300214370,0,1656438233,2022-06-29 01:43:53,求一个影片：是个古装片，男主好像是个将军，带着手下和一群官兵来到一个村子里，村子里有个他之前认识的熟人，但是村子里面好像闹僵尸还是丧尸之类的，白天没事，一到晚上就会出现，好像村子里那个熟人的老婆是坏人，就只记得这些了，小时候看的光盘[tv_笑哭][tv_笑哭]
118648111152 ,385486211,4149755,0,1656437936,2022-06-29 01:38:56,嘬嘬嘬嘬嘬
118648015904 ,385486211,22202916,1,1656437828,2022-06-29 01:37:08,我觉得这个要看他的意图，如果他拍了照主题在于他运动了，那就是欺骗嘛，如果主题在于照片，我觉得完全没问题，这就是为了效果找了道具和地点。[脸红]想拍运动风的照片我去体育场去篮球场拿着篮球拍照。这时候篮球和篮球场就是符合主题的拍摄道具而已。
118647172720 ,385486211,350997221,0,1656437074,2022-06-29 01:24:34,讲的这么好，活该被我三连
118646691488 ,385486211,11997328,0,1656436654,2022-06-29 01:17:34,大学选修的就是飞盘，这个运动真的很累，运动量和足球差不多，我们打比赛都是打小半场
118646625072 ,385486211,243224265,0,1656436630,2022-06-29 01:17:10,天道[滑稽]
118645677472 ,385486211,235940148,3,1656435872,2022-06-29 01:04:32,我的吗，屁事真多，人爱咋拍照咋拍照，要你们管那么多闲事，以后我看啥[疑惑][疑惑][疑惑]
118644616640 ,385486211,27821049,0,1656435062,2022-06-29 00:51:02,她们做的所有事，都只是为了提高自己的价格罢了
118643433392 ,385486211,437564367,1,1656434281,2022-06-29 00:38:01,说的非常好，三连啦！
118643118528 ,385486211,627947306,0,1656434095,2022-06-29 00:34:55,媛前面的字就是个噱头，只要想她们什么都能搞一下
118642521296 ,385486211,34709281,0,1656433724,2022-06-29 00:28:44,体验狗的快乐？
118642438864 ,385486211,11599815,0,1656433631,2022-06-29 00:27:11,氟尿嘧啶片
118641365136 ,385486211,359407866,12,1656433020,2022-06-29 00:17:00,你说她们穿着不得体 你完了  穿衣自由   [来古-震撼]
118641304960 ,385486211,505450005,0,1656432995,2022-06-29 00:16:35,虾猜，能不能帮我查一下，是一个英文歌。调是白什么白什白什哈，白什么白什白什哈，秀玩儿伟么skr
118640217312 ,385486211,629878404,1,1656432447,2022-06-29 00:07:27,三连啊！兄弟们！三连！[热词系列_三连]
118639048416 ,385486211,39708579,2,1656431806,2022-06-28 23:56:46,我在想，如果能像美队一样做到几何学，是不能再飞盘比赛里面成神[妙啊]
118638988816 ,385486211,194248208,19,1656431793,2022-06-28 23:56:33,想起了抖音采访她们说的话  《你管我穿什么》
118638574688 ,385486211,321521871,2,1656431585,2022-06-28 23:53:05,起初我也认为飞盘是给狗玩的，直到接触了真正的极限飞盘，一玩就两个小时，爽！
118638114192 ,385486211,332990879,12,1656431392,2022-06-28 23:49:52,很快就过去了，世界杯一来看她们怎么和足球热潮对抗
118637924240 ,385486211,474804080,5,1656431239,2022-06-28 23:47:19,飞盘呵呵。我们学校已经看不到了。上次有10个很牛逼的人来占我们足球场。为了球场的场地，还诬陷我们足球队。现在他们已经不在学校了。我们足球社50人联合举报他们。他们气不过退学路。笑死。
118634826448 ,385486211,487232465,0,1656429876,2022-06-28 23:24:36,足球场你不说!!!?
118634692976 ,385486211,598720490,10,1656429821,2022-06-28 23:23:41,飞盘圆和飞盘运动者为什么不能同时存在？一些人就这么喜欢标榜自己清白而去侮辱诋毁一个群体？
118633011248 ,385486211,318739465,0,1656429090,2022-06-28 23:11:30,所以飞盘最先是给狗玩的还是给人玩的
118632371808 ,385486211,6936968,1392,1656428803,2022-06-28 23:06:43,鉴定，最简单的方法，看鞋子就行，那些穿休闲鞋复古鞋慢跑甚至复古老爹鞋的基本上就是飞盘缘，因为不谈别的，那些休闲的鞋子适合走路，真的玩飞碟不得跑起来而且得忽快忽慢急停急起的，那更得穿运动鞋
118632074736 ,385486211,187867783,1,1656428708,2022-06-28 23:05:08,我去看了一下飞盘评论区，男女双方打的火热[笑哭]
