comment_id,av,id,like,时间戳,time,comments
118512496320 ,257676702,85661311,0,1656344880,2022-06-27 23:48:00,身材是真的好，减到死也没这个身材
118510402608 ,257676702,8953736,0,1656343902,2022-06-27 23:31:42,等等 你这是用了我们飞盘群的视频啊[doge]
118504113696 ,257676702,435912865,1,1656341120,2022-06-27 22:45:20,原来现在这么多人喜欢当狗被玩啊[哦呼]
118501555632 ,257676702,82091925,0,1656340017,2022-06-27 22:26:57,卧槽橄榄球？低强度？离谱好吧，橄榄球可是强度最大的运动啊，NFL可是全世界身体素质最强的人啊
118501117696 ,257676702,395186409,1,1656339862,2022-06-27 22:24:22,有恶势力在推广，就问飞盘有没有纯罗汉局吧，不都是男女搭配的玩。其他哪个运动不是男女分开玩？
118498989168 ,257676702,10209425,1,1656338912,2022-06-27 22:08:32,"付费的场地谁交钱谁老大，免费的场地谁先来谁老大
这么说还是比较公平的……"
118491841088 ,257676702,24638576,0,1656335799,2022-06-27 21:16:39,很多东西，带上网红两只字，似乎就变味了
118491048960 ,257676702,349781956,0,1656335450,2022-06-27 21:10:50,我们这里虽然是个小县城，但在公园里也有个免费的足球场，没见过这里有人玩飞盘，不过个人感觉飞盘运动还不错，挺有意思的，就是我没玩过，感觉和小时候玩的回旋镖挺类似的，这种运动应该也能像羽毛球一样和别人玩吧，看起来是丢来丢去的，如果将来能推广的话还是不错的，毕竟这项运动不像羽毛球，足球类有专业技术，复杂设备，简单来讲就是高玩，新手差距不大，宜乎众矣
118490003408 ,257676702,434308158,1,1656334975,2022-06-27 21:02:55,我就是踢足球的，我也很奇怪飞盘这运动怎么火起来的，我只知道我是纯粹热爱足球
118486292176 ,257676702,150576061,37,1656333331,2022-06-27 20:35:31,乐，等年底世界杯呗。我倒要看看到时候飞盘还有这么多热度吗？怕不是都去装足球宝贝了吧
118485969648 ,257676702,64921091,1,1656333216,2022-06-27 20:33:36,别占足球场就行，管你在哪玩，在哪卖。我们不关心。这才是重点！
118481475072 ,257676702,37849810,0,1656331084,2022-06-27 19:58:04,男足踢的臭还是不臭，和我们踢球的无关，我们热爱这项运动。运动就是用来强身健体与有无对抗无关，但是最近这些视频里某些同志的穿着，我感觉你是别有用心或者几乎不出门锻炼
118479899120 ,257676702,1978206242,0,1656330397,2022-06-27 19:46:37,找几条边牧玩的不比她们好[抠鼻]
118479115056 ,257676702,1978206242,1,1656330034,2022-06-27 19:40:34,不知道为什么那么多女的热衷于穿紧身的衣服，把自己下面那条勾给勾勒出来[抠鼻]
118473743680 ,257676702,32706271,1,1656327579,2022-06-27 18:59:39,"这是足球场？我还以为正式名称叫田径场呢！
足球婆罗门装恁嘛的，还威胁什么足球不长眼，什么正脚背，这下“阳刚”了?等着，这就去练标枪铅球"
118471437920 ,257676702,8071790,7,1656326522,2022-06-27 18:42:02,只能说这玩意，对踢足球和真正玩飞盘的都是种侮辱
118469490912 ,257676702,400733292,0,1656325542,2022-06-27 18:25:42,这纯属纯属引战
118465887120 ,257676702,372707254,2,1656323800,2022-06-27 17:56:40,我感觉在足球场还是踢足球有意思[脸红]
118461058944 ,257676702,2446997,2,1656321197,2022-06-27 17:13:17,说真的，看到那些飞盘的女孩图片，我完全找不到那个盘在哪里[笑哭][笑哭][笑哭][笑哭]
118460819776 ,257676702,328616636,0,1656321065,2022-06-27 17:11:05,许飞
118460456912 ,257676702,495806906,1,1656320920,2022-06-27 17:08:40,我看到一个男的追着女的叫 不像狗追着主人一样的嘛？ 飞盘 狗玩的而已
118459221168 ,257676702,347097868,1,1656320173,2022-06-27 16:56:13,别占足球场 其他不管足球人的事
118457344192 ,257676702,387310217,0,1656319104,2022-06-27 16:38:24,经典名词《取悦自己》
118456347904 ,257676702,13434471,1,1656318438,2022-06-27 16:27:18,那足球场为什么叫足球场啊？
118455037712 ,257676702,324905788,1,1656317639,2022-06-27 16:13:59,什么锤子的轻度运动，一堆人就在那儿拍短视频，运动个屁。
118452054736 ,257676702,694495767,1,1656315657,2022-06-27 15:40:57,免费的足球场，不能占，交了钱包场，你随便搞
118450076832 ,257676702,50948970,0,1656314327,2022-06-27 15:18:47,说的不玩飞盘就会去踢球一样。。。以前飞盘没火的时候，还不是该干嘛干嘛
118449818528 ,257676702,1811232,0,1656314128,2022-06-27 15:15:28,啊啊啊啊~~~~好怀念小时后丢沙包的日子啊，真的很单纯很好玩……沙包小的可以正反手抛，大的也可以砸和捡……好想玩。~
118449713152 ,257676702,335533889,3,1656314038,2022-06-27 15:13:58,"篮球场跳广场舞，不行[生气]
足球场玩飞盘，行！！！[星星眼]"
118448254144 ,257676702,436596322,5,1656313054,2022-06-27 14:57:34,其实比起这个，我更好奇的是说女性需要化妆和白幼瘦审美是男性对女性的压迫的人 和鼓吹自己是穿着自由和穿那些衣服是为了取悦自己的人是不是一拨[思考]
118445727104 ,257676702,413077633,1,1656311370,2022-06-27 14:29:30,足球老哥就是暴躁，我就喜欢暴躁老哥，说话就是得劲[傲娇]
118442284832 ,257676702,291218361,0,1656309199,2022-06-27 13:53:19,上海已经定不了足球场了想踢球也没地方踢了[大哭]
118441950256 ,257676702,1326941331,4,1656308918,2022-06-27 13:48:38,狗都比这些玩飞盘的人玩的好，这些人还有脸跟踢足球的人抢足球场了。
118437829920 ,257676702,173599785,1,1656306636,2022-06-27 13:10:36,所以飞盘的发展可以有自己的场地吗，足球场求放过。讲真的，中国运动的发展啊，比如足球，实际上也可以很简单，只要高考有足球项目用不了二十年中国足球必进世界杯[傲娇]
118437473424 ,257676702,301081900,3,1656306451,2022-06-27 13:07:31,遇到过一伙男男女女飞盘狗，占了我们的免费足球场，不让我们踢球，还说是他们先占的场地。
118435575792 ,257676702,18346784,2,1656305537,2022-06-27 12:52:17,我就极度厌恶各种不纯粹的行为。卖就卖，装什么飞盘，装什么陪玩游戏，装什么主播。
118435042768 ,257676702,343912091,1,1656305234,2022-06-27 12:47:14,这么说吧，首先要有小孩爱踢球，有得踢球，中国足球才有未来[酸了]
118434176064 ,257676702,443912296,2,1656304876,2022-06-27 12:41:16,如果说。。。因为飞盘扩建足球场，那也不错[doge]
118433958208 ,257676702,401270890,2,1656304796,2022-06-27 12:39:56,我就是踢足球的，我也看见过人玩飞盘，我只能说大部分人玩飞盘都不是抱着运动的目的。如果你说你也是篮球足球这种锻炼身体当然可以接受。你玩10分钟飞盘休息一下拍10分钟照我真的接受不了，这不是纯纯的占地方么，这是来运动的？第一本来没啥身体对抗，大部分人都是以小跑来移动，根本不冲刺，还要10分钟休息一下。而且规则大部分人都不懂。那你站着足球场，让真正踢球的人没球踢，你还不好好利用足球场。中国本来足球场地就少。这种行为不就是在浪费足球场地资源么？
118433166208 ,257676702,442486585,1,1656304408,2022-06-27 12:33:28,不想说啥了，飞盘狗别让我在足球场上看见你们
118432279088 ,257676702,14097189,0,1656304023,2022-06-27 12:27:03,MKBHD是飞盘运动的职业选手[脱单doge]
118430111872 ,257676702,282828120,2,1656303008,2022-06-27 12:10:08,昨天去省博物馆，一堆女生凹造型拍照的，还有人说我们红军拿的是土枪土炮，我想着仿造毛瑟的步枪跟土枪铳有区别的吧，她们是不是认为二战以前的枪都是土枪[tv_笑哭]，主要旁边还放了挺机枪
118429911328 ,257676702,324899370,0,1656302949,2022-06-27 12:09:09,现在不抢场地，以后凭什么增加场地？
118429648512 ,257676702,6007371,0,1656302800,2022-06-27 12:06:40,我牵着狗去参加可以吗（本人男）
118429636928 ,257676702,68541966,0,1656302783,2022-06-27 12:06:23,老衲一辈子铁骨铮铮，为何推送这个给我！[思考]
118426582064 ,257676702,2010307096,2,1656301171,2022-06-27 11:39:31,所以，你说了半天，核心问题不应该是占领足球场吗？一句所谓的升华就带过了？？
118425108000 ,257676702,386642451,0,1656300410,2022-06-27 11:26:50,第一次听到的东西就火了[喜极而泣]
118425123840 ,257676702,14889445,0,1656300310,2022-06-27 11:25:10,飞盘为什么不能到篮球场玩[doge][doge][doge]
118423777824 ,257676702,42589821,0,1656299501,2022-06-27 11:11:41,在大学看人玩过，一群人玩的跟橄榄球一样，贼暴力[笑哭]
118420470208 ,257676702,520212472,0,1656297471,2022-06-27 10:37:51,女足踢的还可以啊[doge]
118418911440 ,257676702,237059197,0,1656296392,2022-06-27 10:19:52,哦吼，和孩子学习不好，然后怨手机的家长，有异曲同工之妙啊！
118417573536 ,257676702,128420602,1,1656295502,2022-06-27 10:05:02,"穿衣自由，但心中都有杆秤的。
足球场扔飞盘？脑子抽了啊，换个场地吧。
还有我们打篮球赢了在场，输了下场，队友都是临时凑的，可不需要出去撸串喝酒。"
118414366208 ,257676702,20365589,0,1656293127,2022-06-27 09:25:27,飞盘，腰旗橄榄球门槛低，足球脚下没点技术就是满场瞎跑了。
118410297744 ,257676702,367481042,1,1656289722,2022-06-27 08:28:42,说到底还不是有人乱搞男女关系，搞的运动失去本来的性质
118403380528 ,257676702,92626270,0,1656276389,2022-06-27 04:46:29,爱玩飞盘就玩，爱跳广场舞就跳，只要别占用专业场地，随他们怎么玩。
118402220496 ,257676702,3100659,0,1656272744,2022-06-27 03:45:44,可能平时都是听中国专业球员一万多，一下子因为一个飞盘才发现原来我国业余踢球人员这么多啊，现在还得跟其他运动抢场地了
118397509504 ,257676702,247773941,0,1656265223,2022-06-27 01:40:23,"剧本杀玩的不少，但都是自己约人去玩，很少组外人，觉得要沉浸式演戏体验还是自己人玩的默契，没有各种奇奇怪怪的事情
踢完足球吃烧烤则纯粹只是馋……"
118395955168 ,257676702,476456750,0,1656263649,2022-06-27 01:14:09,md太对了[吃瓜]
118393001904 ,257676702,209395499,2,1656261579,2022-06-27 00:39:39,既然都这么看不起中国足球，那么希望他变成啥样，你们都不要管了，别骂也别夸，让我们自己在这一小片地好好过就行，唉...?
118384516848 ,257676702,13720283,0,1656257160,2022-06-26 23:26:00,其实…说实话如果真的运动，紧身瑜伽裤（瑜伽短裤）+运动小背心确实是最舒服最自由的。我在家跳操，拉起窗帘也这么穿…穿的少运动完洗起来也方便，干起来也快。但让我穿出门我是不太敢的…
118377358640 ,257676702,12018975,2,1656253979,2022-06-26 22:32:59,就冲你知道胡叼盘这个梗，我三连了。
118377371376 ,257676702,401981047,0,1656253909,2022-06-26 22:31:49,我从小到大穿双球一样踢球，请别误导踢足球贵，同样支持飞盘运动带动全民运动。
118376568416 ,257676702,281764101,0,1656253567,2022-06-26 22:26:07,一句话，2222年中国还是进不了世界杯呗[嗑瓜子]
118375812624 ,257676702,783262,0,1656253309,2022-06-26 22:21:49,我支持看飞盘，毕竟我看中国足球上火，看飞盘有益身心
118374109584 ,257676702,43856470,9,1656252563,2022-06-26 22:09:23,"到足球场玩飞盘?

到游泳馆练田径?"
118372066672 ,257676702,35771490,4,1656251710,2022-06-26 21:55:10,在我花钱租的场地玩，见一个踢爆一个头，就当练任意球了
118370996544 ,257676702,407496457,0,1656251152,2022-06-26 21:45:52,看似说了，其实什么也没说
118354896272 ,257676702,385543407,0,1656243649,2022-06-26 19:40:49,这个运动还是运动只不过接触了一些不好的人
118354591696 ,257676702,347097549,1,1656243489,2022-06-26 19:38:09,运动就是别谁不比谁高贵了，文无第一武无第二，足球就是第一运动，只不过高贵这个词属实难听，会激发矛盾，可以换个其他词
118353786080 ,257676702,224716434,0,1656243151,2022-06-26 19:32:31,以前我们是没人踢现在是连场地都没了
118353111360 ,257676702,1006184755,0,1656242894,2022-06-26 19:28:14,没人说不能玩，是不能在足球场玩。
118351433264 ,257676702,1041137655,1,1656242100,2022-06-26 19:15:00,不懂就问，飞盘能像国外一样变成职业比赛吗？抢占足球场，但是收视率能和足球比吗？[嗑瓜子]
118349991136 ,257676702,49163337,0,1656241382,2022-06-26 19:03:02,你别说飞盘还挺好玩，小时候90年代老和我爸爸玩，其实up主说的挺好的，不管干嘛，只有大家都可以出去运动起来，就比在家宅好很多，还可以有社交作用，认识一些朋友，还可以带动一波就业[打call]
118349528112 ,257676702,27805991,0,1656241144,2022-06-26 18:59:04,男足的未来难道是因为外界因素才没的？
118347555888 ,257676702,71389747,1,1656240189,2022-06-26 18:43:09,足球场踢足球，篮球场打篮球，事情就解决了。
118343626144 ,257676702,453372098,5,1656238361,2022-06-26 18:12:41,要玩飞盘就去野草地玩
118343511936 ,257676702,453372098,1,1656238323,2022-06-26 18:12:03,足球鞋不算贵其实
118342953472 ,257676702,269479355,2,1656238091,2022-06-26 18:08:11,飞盘就是zb炒起来的而已，虽然足球之类的商业运动也是zb游戏，但是飞盘这种炒起来更像是流量明星，足球的商业化，职业化，文化，技战术是飞盘不能比的，想想真是七八万人在球场扔飞盘确实挺好笑的。
118342205312 ,257676702,453372098,35,1656237720,2022-06-26 18:02:00,足球场凭什么玩飞盘，要玩飞盘就去野草地
118339576688 ,257676702,449699295,10,1656236375,2022-06-26 17:39:35,"公共场所讲究先来后到，既然你说足球场只能踢足球，那么请你给我建个飞盘场。
21世纪了都，大家都是文明人，讲究个文明礼貌。你不来踢球别人也不能用，别人用了等你过来就是一通外脚背，那不是纯混蛋？
这种大规模的都有组织者，加个微信好好说，当一个文明人。
而且不是不允许篮球场跳广场舞，而是老年人倚老卖老强占太气人。要是老年人会说话，早点去占了场子，来打篮球的了，跟人说，“我们老年人睡得早，运动运动跳一会儿就走，八点钟我们就散了，你们该打球打球。回来咱们可以换，你们下午打，我们晚上跳”要是这么说，不也没矛盾了？"
118338297936 ,257676702,372219305,1,1656235771,2022-06-26 17:29:31,我是男的，但是我觉得飞盘是真的好玩（学校最近在搞这个），关键在于跑动很爽，而且谁会不喜欢这种飞起来的感觉呢？[doge]
118337567104 ,257676702,23669147,1,1656235398,2022-06-26 17:23:18,阻碍足球发展这话简直就是搞笑~
118336723776 ,257676702,94408018,0,1656234887,2022-06-26 17:14:47,想起在群里看到的海炮[吃瓜]去海滩上能看见女的游泳，靠近了她会问你学不学游泳，你问怎么学，她说四百一次去深水区学[doge]这算不算游泳援
118333842848 ,257676702,379740230,0,1656233391,2022-06-26 16:49:51,头一回听说这玩意
118333080208 ,257676702,1097873549,0,1656233032,2022-06-26 16:43:52,如果正经玩飞盘，足球鞋是必要装备，人草上你穿TF都很可能打滑，更别说穿椰子和各式潮鞋了[翻白眼]
118333200976 ,257676702,308213130,3,1656233021,2022-06-26 16:43:41,无非就是一帮卖的，开始玩飞盘，想卖个好价位，飞盘风评被害
118332730240 ,257676702,19572173,0,1656232770,2022-06-26 16:39:30,开会穿比基尼   穿衣自由
118332183504 ,257676702,1076080952,1,1656232469,2022-06-26 16:34:29,不用担心，我话放这，最多再火不过4个月，天一冷没法露肉你们看还有人玩飞盘没
118331673712 ,257676702,543323287,6,1656232261,2022-06-26 16:31:01,在这充满谩骂的时代，你选择足球后悔吗？我从未后悔
118330102160 ,257676702,399448807,3,1656231317,2022-06-26 16:15:17,反正你飞你的，我踢我的，被球砸死了自己挨着[给心心]
118329598272 ,257676702,472556721,0,1656231084,2022-06-26 16:11:24,作为一名从小踢球的学生，看到场被飞盘占了真的很开心[微笑]
118326648672 ,257676702,519566747,0,1656229276,2022-06-26 15:41:16,问题是这项运动没火之前足球也没厉到哪去倒是烂的不成。
118325222144 ,257676702,305574571,3,1656228433,2022-06-26 15:27:13,狗玩的东西也配媲美世界第一运动了？
118324431392 ,257676702,314065314,0,1656227986,2022-06-26 15:19:46,狗狗:这个一开始是跟我们狗狗玩的，你们人类女人凑什么热闹！
118321471984 ,257676702,358075145,1,1656226252,2022-06-26 14:50:52,1：50这叫扣大锅？飞盘难道不会阻碍足球发展？去足球场玩飞盘吧，在我看来就和去食堂拉屎吧，去厨房蹦极吧一样离谱无法理解，我甚至都没听说过这项活动！他也配称为运动项目？
118315161680 ,257676702,387215320,0,1656222777,2022-06-26 13:52:57,[给心心]
118315008784 ,257676702,87797293,0,1656222672,2022-06-26 13:51:12,建议换铁饼
118310929824 ,257676702,38448694,0,1656220636,2022-06-26 13:17:16,皮酥脆！肉滑有汁！骨都带味！
118309409120 ,257676702,417219420,5,1656219910,2022-06-26 13:05:10,对一个90后的我观念里还是飞盘是和狗玩的游戏，不支持反驳。
118307603344 ,257676702,267693634,25,1656219049,2022-06-26 12:50:49,危害中国足球我不管，我只是一个喜欢踢球的年轻人，足球场就是足球场，你不拿来踢球干什么，玩飞盘怎么不去库伦贝尔大草原玩，那些草地多好啊[打call][打call]
118307192064 ,257676702,1282205615,0,1656218926,2022-06-26 12:48:46,橄榄球是轻运动，很久以前看国外橄榄球比赛，不都是抱球直接碰撞的吗？
118306411520 ,257676702,268624905,0,1656218514,2022-06-26 12:41:54,有一点不同意阿婆主，足球的成本并不高，一双球鞋，普通的200～400，迪卡侬甚至有100的，场地费我这里一线城市一场下来50一个人左右，我觉得不高。足球难在人数凑不齐和入门对新手不友好。
118302128448 ,257676702,36778976,0,1656216668,2022-06-26 12:11:08,王八蛋 家事
118300823760 ,257676702,474240169,0,1656216088,2022-06-26 12:01:28,反正足球场，踢球的踢球，玩飞盘就玩吧，正脚背力气不小
118300435744 ,257676702,4718700,7,1656215912,2022-06-26 11:58:32,花钱租场就随意了，公共场地那就老规矩分个先来后到有能者占之了，一个得靠炒作才能露个头的网红运动就配跟足球相提并论未免有点过度抬举了，要是中国足球因为这么个运动就能构成阻碍，那就凭这么脆弱的生命力趁早停了算了
118297952016 ,257676702,1779205731,1,1656214761,2022-06-26 11:39:21,可是，重点是，足球场是踢足球的啊[怪我咯]
118296167024 ,257676702,207723132,0,1656213858,2022-06-26 11:24:18,乐[OK]玩了几年次次都是一帮大老爷们打比赛，是我社交圈窄了
118293684336 ,257676702,69116446,0,1656212613,2022-06-26 11:03:33,美琪和她妈妈上山去
118293425408 ,257676702,7577254,2,1656212509,2022-06-26 11:01:49,从热评看up主节奏没带起来啊[吃瓜]
118293250720 ,257676702,471414324,0,1656212443,2022-06-26 11:00:43,租得起场地，爱玩什么玩什么[OK]，不服你跟老板说呀[高考加油]
118293088800 ,257676702,477227684,0,1656212329,2022-06-26 10:58:49,不随便占用足球场的话没人管他
118292966400 ,257676702,29074677,0,1656212239,2022-06-26 10:57:19,大一体育课选的飞盘，挺好玩Y
118291649120 ,257676702,431183615,1,1656211536,2022-06-26 10:45:36,我完全赞同女性都穿比基尼出行，如果没有人拍照我愿意给她们来当摄影师。至于飞盘，我和儿子在家里扔过，老婆第一天买回来我就问，是不是家里准备养狗，后来告诉我是儿子看了动画片想玩的，现在已经吃灰。
118291623344 ,257676702,6962029,1,1656211493,2022-06-26 10:44:53,可以在]人r河米闱觯但有人硖咔虻脑自X出龅匦胁唬
118291409456 ,257676702,1691839800,0,1656211402,2022-06-26 10:43:22,男的没人玩飞盘？？？那玩飞盘的男人叫啥？？？
118291462448 ,257676702,344986954,0,1656211379,2022-06-26 10:42:59,up对现象的分析的挺不错的，不过明眼人都看的出来“阻碍中国足球发展这种言论”就是句气话，讽刺那些乱占他人运动场地的人罢了，当然这说法夸大其词了，但对此没有讲到我觉得有失偏颇了，绝大部分人对你讲的啥运动、什么媛的无所谓的，管好自己就行[思考][思考][思考]
118290423904 ,257676702,225523797,0,1656210822,2022-06-26 10:33:42,为什么球场老板愿意租给玩飞盘的不租给踢球的？还不是觉得飞盘赚钱？踢球的太抠门？
118289889616 ,257676702,58832802,0,1656210574,2022-06-26 10:29:34,咋不上街穿泳装呢？
118283153616 ,257676702,399487396,9,1656206390,2022-06-26 09:19:50,没事，今年世界杯，让他们看看什么是真真的热度，到时候谁还玩飞盘啊，都想来足球场练练脚，足球百年底蕴可不是闹着玩的，到时候就知道什么是真正的世界第一运动
118283004768 ,257676702,445966856,29,1656206293,2022-06-26 09:18:13,我不仅歧视玩飞盘的人，我还歧视那些不歧视玩飞盘的[喜欢][喜欢][喜欢][喜欢]
118277348480 ,257676702,13125488,1,1656201677,2022-06-26 08:01:17,想起了之前去图书馆看书，有几个人也不看书就坐那玩手机，一会拿起手机摆个动作给自己拍几张照片，然后去书柜那里，再摆动作然后互相拍，拍完就走了[呲牙]
118277390848 ,257676702,299869684,0,1656201632,2022-06-26 08:00:32,还没弄清楚吗归根到底是因为飞盘是中国新兴运动，再加上足球场少啊
118277260000 ,257676702,208235757,0,1656201606,2022-06-26 08:00:06,所以双方的矛盾起因是飞盘没有专用的运动场地吧
118277133056 ,257676702,395580168,0,1656201306,2022-06-26 07:55:06,中国的足球已经不适合在中国的大城市里发展了，中国足球的希望在小城市，在乡镇，那里才是中国足球的希望。
118276631728 ,257676702,98980037,0,1656200884,2022-06-26 07:48:04,关键是以前到处足球场，整天一堆人踢足球的时候也没见足球怎么发展啊，反而一天比一天次。
118276280608 ,257676702,345907615,53,1656200431,2022-06-26 07:40:31,建议赶紧建飞盘场，然后我进去踢足球[doge]
118272494256 ,257676702,5069649,0,1656191865,2022-06-26 05:17:45,足球场占着玩飞盘，和广场舞大妈没差别
118270845952 ,257676702,414048655,0,1656186374,2022-06-26 03:46:14,都喜欢中国足球了 有这种脑回路不奇怪
118266661792 ,257676702,326994563,7,1656179777,2022-06-26 01:56:17,有的人见到有关足球的就要刷一句很蓝的啦和海参，还怪别人不推广
118264233024 ,257676702,170528592,1,1656177637,2022-06-26 01:20:37,我是狂热足球爱好者（本人个性偏左）但是我也觉得无所谓占又占不了多少场地 踢球时抬头看看还赏心悦目对吧[doge]
118260433952 ,257676702,1399072355,0,1656174990,2022-06-26 00:36:30,看完评论，我就说一句：国足，自求多福吧。
118258577952 ,257676702,2749031,0,1656173934,2022-06-26 00:18:54,我选择每天做一百个俯卧撑
118254927664 ,257676702,218544,1,1656172174,2022-06-25 23:49:34,什么时候在b站上看nfl的人和看飞盘的人一样多，我就信了
118254980848 ,257676702,379507334,0,1656172158,2022-06-25 23:49:18,我知道了回头就让我奶奶去打到篮球场跳广场舞
118254514832 ,257676702,33643431,0,1656171959,2022-06-25 23:45:59,当年上民族体育课，有种类似的运动，叫花炮
118247140112 ,257676702,20940074,2,1656168698,2022-06-25 22:51:38,不玩飞盘，刚刚看完视频才知道的词。但是挺有意思的是，给各位说个笑话，中国男足说影响发展了。[doge]
118242074768 ,257676702,295286706,0,1656166566,2022-06-25 22:16:06,飞盘在我印象当中真的就是狗叼的 类似的活动不是没有 你可以打沙包呀 你干嘛非得去扔个盘子 ？说成本低的 我想说你成本再低 你能比得过沙包 ？沙包还只是两块破布缝一缝 就好了
118241171296 ,257676702,456729082,0,1656166126,2022-06-25 22:08:46,玩可以，不要占场地
118240964016 ,257676702,5720994,1,1656166038,2022-06-25 22:07:18,我觉得吧，足球场也不是只能限定踢足球，只要别人包场付了钱，玩橄榄球、飞盘也没问题，甚至在那晒日光浴，打手游也行。
118236741664 ,257676702,95161011,0,1656164129,2022-06-25 21:35:29,你要说胡叼盘，那我可就三连了
118236490112 ,257676702,1441123,1,1656164006,2022-06-25 21:33:26,足球就比飞盘高贵？我玩不懂，没玩过飞盘但是凭啥足球场不能玩飞盘了？运动也能搞歧视的？
118235557376 ,257676702,560252566,1,1656163612,2022-06-25 21:26:52,各位b站友友们，大家一起创业造狗狗的东西吧，说不定下个火起来的就是住狗窝呢[doge][doge][doge][doge][doge][豹富][豹富][豹富][豹富][豹富]
